text,source_type,date,title,text
"A community based TL shared that he prefers to use Nivolumab over Pembrolizumab, because he rather see his pts more frequently. Also, Nivolumab has RCC indication, as well an unrestrictive lung indication regardless of PD-L1 status.",Unknown,1458792000.0,,"A community based TL shared that he prefers to use Nivolumab over Pembrolizumab, because he rather see his pts more frequently. Also, Nivolumab has RCC indication, as well an unrestrictive lung indication regardless of PD-L1 status."
"A TL commented that melanoma treatment has evolved so quickly, including not only several new agents available but especially Opdivo having many approvals in a short timeframe, that some oncologists may feel overwhelmed. Considers that education by BMS is key to help physicians understand Opdivo's clinical data and appropriate patient types for Opdivo + Yervoy Regimen and Opdivo monotherapy.",Unknown,1454994000.0,,"A TL commented that melanoma treatment has evolved so quickly, including not only several new agents available but especially Opdivo having many approvals in a short timeframe, that some oncologists may feel overwhelmed. Considers that education by BMS is key to help physicians understand Opdivo's clinical data and appropriate patient types for Opdivo + Yervoy Regimen and Opdivo monotherapy."
"A TL commented that her experience with Yervoy as monotherapy in metastatic melanoma has not been good, both from an efficacy and safety standpoint. Therefore she is more inclined to prescribe Opdivo monotherapy than the regimen in the 1st line setting. After discussing the regimen MOA, rationale for combining both drugs, clinical trial data, and safety profile she stated that it makes perfect sense to combine Yervoy with Opdivo and that it was clearly reflected by the outstanding clinical response compared to monotherapy. Therefore, she is now inclined to use the regimen for her next 1st line metastatic melanoma patient since this is a very aggressive disease where there is no time to waste. You want the best clinical efficacy available in 1st line.",Unknown,1457672400.0,,"A TL commented that her experience with Yervoy as monotherapy in metastatic melanoma has not been good, both from an efficacy and safety standpoint. Therefore she is more inclined to prescribe Opdivo monotherapy than the regimen in the 1st line setting. After discussing the regimen MOA, rationale for combining both drugs, clinical trial data, and safety profile she stated that it makes perfect sense to combine Yervoy with Opdivo and that it was clearly reflected by the outstanding clinical response compared to monotherapy. Therefore, she is now inclined to use the regimen for her next 1st line metastatic melanoma patient since this is a very aggressive disease where there is no time to waste. You want the best clinical efficacy available in 1st line."
"A TL, clinical trials PI, and AI commented that the 60% reduction in PFS of the Opdivo + Yervoy Regimen compared to Yervoy in metastatic melanoma is extremely impressive and considers the adverse event profile manageable. Therefore, it should be the SOC.",Unknown,1455598800.0,,"A TL, clinical trials PI, and AI commented that the 60% reduction in PFS of the Opdivo + Yervoy Regimen compared to Yervoy in metastatic melanoma is extremely impressive and considers the adverse event profile manageable. Therefore, it should be the SOC."
"A TL, clinical trials PI, and AI commented that, as part of her role as a consultant for Oncology Analytics (oncology pathways company), she has recently received several requests from oncologists to use the Opdivo + Yervoy Regimen in patients with metastatic melanoma that had progressed after previous therapy with Yervoy. Therefore, she considers there is a need for Regimen data in this scenario.",Unknown,1455598800.0,,"A TL, clinical trials PI, and AI commented that, as part of her role as a consultant for Oncology Analytics (oncology pathways company), she has recently received several requests from oncologists to use the Opdivo + Yervoy Regimen in patients with metastatic melanoma that had progressed after previous therapy with Yervoy. Therefore, she considers there is a need for Regimen data in this scenario."
A TL commented regarding 067 data that Opdivo + Yervoy Regimen mPFS is something never seen before. It is now his 1st option for all metastatic melanoma patients.,Unknown,1455253200.0,,A TL commented regarding 067 data that Opdivo + Yervoy Regimen mPFS is something never seen before. It is now his 1st option for all metastatic melanoma patients.
"A TL and BMS speaker commented that the best treatment option for 1st line metastatic melanoma patients is Opdivo + Yervoy Regimen. There is an increase in toxicity but manageable with available algorithms. He will prescribe the Regimen in most of his 1st line patients irrespective of age. One exception in which he will prefer Opdivo monotherapy is for patients with poor compliance with appointments, that are frequently lost to follow-up. His main concern is that the patient will not contact the office when an adverse event occurs and will wait until it is too late. The other exception is patients with poor PS and comorbidities unable to tolerate its AE profile.",Unknown,1454994000.0,,"A TL and BMS speaker commented that the best treatment option for 1st line metastatic melanoma patients is Opdivo + Yervoy Regimen. There is an increase in toxicity but manageable with available algorithms. He will prescribe the Regimen in most of his 1st line patients irrespective of age. One exception in which he will prefer Opdivo monotherapy is for patients with poor compliance with appointments, that are frequently lost to follow-up. His main concern is that the patient will not contact the office when an adverse event occurs and will wait until it is too late. The other exception is patients with poor PS and comorbidities unable to tolerate its AE profile."
"A TL and BMS speaker commented that looking at the PFS KM Curve from 067 it was very revealing seeing the very impressive difference in PFS between Yervoy monotherapy and the Opdivo + Yervoy Regimen. For him, Yervoy was a breakthrough being the first checkpoint inhibitor and first treatment that provided the possibility of long term survival for melanoma patients. But now looking into that graph it is evident that Opdivo is an improvement over Yervoy and now the Regimen is an impressive improvement over both monotherapies. It is amazing to see how the science of Immuno-Oncology has evolved so quickly optimizing treatment options for melanoma patients. Based on this data, the Regimen should be the new SOC in 1st line metastatic melanoma.",Unknown,1454994000.0,,"A TL and BMS speaker commented that looking at the PFS KM Curve from 067 it was very revealing seeing the very impressive difference in PFS between Yervoy monotherapy and the Opdivo + Yervoy Regimen. For him, Yervoy was a breakthrough being the first checkpoint inhibitor and first treatment that provided the possibility of long term survival for melanoma patients. But now looking into that graph it is evident that Opdivo is an improvement over Yervoy and now the Regimen is an impressive improvement over both monotherapies. It is amazing to see how the science of Immuno-Oncology has evolved so quickly optimizing treatment options for melanoma patients. Based on this data, the Regimen should be the new SOC in 1st line metastatic melanoma."
A TL and Access Influencer commented that the difference in PFS between Yervoy and Opdivo + Yervoy Regimen in 067 is extremely impressive. Clear example of how by combining two I-O agents clinical efficacy can markedly improve. The Opdivo + Yervoy Regimen should be the new SOC in 1st line metastatic melanoma.,Unknown,1454994000.0,,A TL and Access Influencer commented that the difference in PFS between Yervoy and Opdivo + Yervoy Regimen in 067 is extremely impressive. Clear example of how by combining two I-O agents clinical efficacy can markedly improve. The Opdivo + Yervoy Regimen should be the new SOC in 1st line metastatic melanoma.
"A Regional TL clinical trials PI with academic affiliation at a VA hospital commented, regarding Yervoy adjuvant, that he will prefer using the 3mg/kg dose for only 4 doses also in this setting. He believes the 10mg/kg dose including a maintenance phase is too high and will result in more toxicity.",Unknown,1454648400.0,,"A Regional TL clinical trials PI with academic affiliation at a VA hospital commented, regarding Yervoy adjuvant, that he will prefer using the 3mg/kg dose for only 4 doses also in this setting. He believes the 10mg/kg dose including a maintenance phase is too high and will result in more toxicity."
A community oncologist commented that Opdivo + Yervoy Regimen efficacy in metastatic melanoma seems very good. Shared that the first Regimen melanoma patient in her group practice recently received the first dose but for her it remains to be seen if patient tolerability is good enough to derive clinical benefit in light of increased toxicity seen in clinical trials.,Unknown,1454648400.0,,A community oncologist commented that Opdivo + Yervoy Regimen efficacy in metastatic melanoma seems very good. Shared that the first Regimen melanoma patient in her group practice recently received the first dose but for her it remains to be seen if patient tolerability is good enough to derive clinical benefit in light of increased toxicity seen in clinical trials.
"A TL with academic affiliation commented that he believed the previous Opdivo + Yervoy Regimen approval for BRAF wild type only could change current clinical practice since before the Regimen approval oncologists in PR usually started patients on Yervoy first-line irrespective of BRAF status. Most even started treatment without knowing the BRAF status. But with the previous Regimen approval based on 069, the oncologists had to perform BRAF testing to determine if the patient was eligible for treatment. In case the patient was BRAF mutant, the oncologists had to consider the option of prescribing a BRAF or BRAF+MEK combo since the Regimen was not FDA approved for mutant patients. Now with this new approval irrespective of BRAF status, he believes this is no longer an issue and most PR oncologists will keep selecting immunotherapy as their first-line choice irrespective of mutation status.",Unknown,1454648400.0,,"A TL with academic affiliation commented that he believed the previous Opdivo + Yervoy Regimen approval for BRAF wild type only could change current clinical practice since before the Regimen approval oncologists in PR usually started patients on Yervoy first-line irrespective of BRAF status. Most even started treatment without knowing the BRAF status. But with the previous Regimen approval based on 069, the oncologists had to perform BRAF testing to determine if the patient was eligible for treatment. In case the patient was BRAF mutant, the oncologists had to consider the option of prescribing a BRAF or BRAF+MEK combo since the Regimen was not FDA approved for mutant patients. Now with this new approval irrespective of BRAF status, he believes this is no longer an issue and most PR oncologists will keep selecting immunotherapy as their first-line choice irrespective of mutation status."
A TL and AI commented that the most impressive efficacy result from the 067 trial is the early separation of the PFS curves accompanied by a tail that maintains that separation.,Unknown,1454648400.0,,A TL and AI commented that the most impressive efficacy result from the 067 trial is the early separation of the PFS curves accompanied by a tail that maintains that separation.
A community oncologist commented that Opdivo + Yervoy Regimen efficacy in metastatic melanoma is impressive. She will definitively prescribe the Regimen for all eligible 1st line metastatic melanoma patients. This is a very aggressive disease and there is no time to waste. You want the best clinical efficacy available in 1st line. If you wait to 2nd or later lines it may be too late.,Unknown,1454648400.0,,A community oncologist commented that Opdivo + Yervoy Regimen efficacy in metastatic melanoma is impressive. She will definitively prescribe the Regimen for all eligible 1st line metastatic melanoma patients. This is a very aggressive disease and there is no time to waste. You want the best clinical efficacy available in 1st line. If you wait to 2nd or later lines it may be too late.
"During a clinical trial/research discussion, TL commented that the triplet design in melanoma should only be done in clinical trials, not in practice. Concerns about this approach included 1) the cost of I-O + BRAF/MEK triplet and 2) using all your treatment options up front.",Unknown,1478145600.0,,"During a clinical trial/research discussion, TL commented that the triplet design in melanoma should only be done in clinical trials, not in practice. Concerns about this approach included 1) the cost of I-O + BRAF/MEK triplet and 2) using all your treatment options up front."
"During the Q&A following a presentation about age, melanoma, and the tumor microenvironment, physician stated that in his experience elderly patients (80+ years) do well with checkpoint inhibitors. Elderly patients tend to have fewer toxicities than younger patients. Physician did not specify monotherapy vs combination. Presenter stated that elderly patients demonstrate better response to PD-1 inhibitors and are less responsive to anti-CTLA4. This is likely due to fewer Tregs in elderly patients.",Unknown,1474171200.0,,"During the Q&A following a presentation about age, melanoma, and the tumor microenvironment, physician stated that in his experience elderly patients (80+ years) do well with checkpoint inhibitors. Elderly patients tend to have fewer toxicities than younger patients. Physician did not specify monotherapy vs combination. Presenter stated that elderly patients demonstrate better response to PD-1 inhibitors and are less responsive to anti-CTLA4. This is likely due to fewer Tregs in elderly patients."
"Community HCP prefers Opdivo monotherapy vs regimen for some melanoma patients due to concerns about monitoring for imAEs (one patient is incarcerated, another is elderly).",Unknown,1459396800.0,,"Community HCP prefers Opdivo monotherapy vs regimen for some melanoma patients due to concerns about monitoring for imAEs (one patient is incarcerated, another is elderly)."
"During discussion about imAE and management algorithms, TL stated that they are planning to monitor troponin when using regimen. Currently undecided if this will be done early in course of treatment only or for longer period of time.",Unknown,1481259600.0,,"During discussion about imAE and management algorithms, TL stated that they are planning to monitor troponin when using regimen. Currently undecided if this will be done early in course of treatment only or for longer period of time."
Community TL participating in E6134 commented that this study is out of date now. His preference is to start with I-O and use targeted agents as later lines of therapy.,Unknown,1480568400.0,,Community TL participating in E6134 commented that this study is out of date now. His preference is to start with I-O and use targeted agents as later lines of therapy.
"Community HCP shared that one of his patients had a CR after regimen and has been on maintenance nivo for a year. Physician has discussed stopping therapy with the patient, but instead is using a Q4W schedule. Patient continues to respond with no evidence of disease.",Unknown,1479531600.0,,"Community HCP shared that one of his patients had a CR after regimen and has been on maintenance nivo for a year. Physician has discussed stopping therapy with the patient, but instead is using a Q4W schedule. Patient continues to respond with no evidence of disease."
"TL at academic institution commented that they get PD-L1 values as part of the standard panel from CARIS, but she does not use PD-L1 to make treatment decisions. The immune system is too dynamic and complex to rely on PD-L1 alone. Having PD-L1 expression level is only helpful when considering a patient for a clinical trial.",Unknown,1472961600.0,,"TL at academic institution commented that they get PD-L1 values as part of the standard panel from CARIS, but she does not use PD-L1 to make treatment decisions. The immune system is too dynamic and complex to rely on PD-L1 alone. Having PD-L1 expression level is only helpful when considering a patient for a clinical trial."
TL commented that a current challenge in BRAF mut melanoma is what to do after patients have failed both I-O and BRAF/MEK inhibitor therapy. There are no trial options for this patient population.,Unknown,1472184000.0,,TL commented that a current challenge in BRAF mut melanoma is what to do after patients have failed both I-O and BRAF/MEK inhibitor therapy. There are no trial options for this patient population.
"Regional TL shared that she will restart nivo monotherapy in patients that d/c regimen due to toxicity once imAE has resolved. In her experience, these patients have responded well without recurrence of AE.",Unknown,1472184000.0,,"Regional TL shared that she will restart nivo monotherapy in patients that d/c regimen due to toxicity once imAE has resolved. In her experience, these patients have responded well without recurrence of AE."
Academic TL stated that he is using PET scan results to determine whether or not to stop maintenance therapy. He scans patient at 1 year and discontinues maintenance therapy in the absence of FDG signal. Continues treatment when FDG positive and determines if additional treatment approaches are needed,Unknown,1467345600.0,,Academic TL stated that he is using PET scan results to determine whether or not to stop maintenance therapy. He scans patient at 1 year and discontinues maintenance therapy in the absence of FDG signal. Continues treatment when FDG positive and determines if additional treatment approaches are needed
"TL was interested in -012 nivo + ipi approach but believes there is a dose response with Ipi supporting 3 mg/kg in current regimen. If a patient is responding (scan after 2nd dose), you may be able to lengthen the interval between doses and minimize toxicity.",Unknown,1467345600.0,,"TL was interested in -012 nivo + ipi approach but believes there is a dose response with Ipi supporting 3 mg/kg in current regimen. If a patient is responding (scan after 2nd dose), you may be able to lengthen the interval between doses and minimize toxicity."
"TL mentioned that from their experience with regimen, younger patients and/or those with lower disease burden tend to be the patients that develop imAEs. Perhaps patients with low burden disease need 1-2 doses vs all 4 and would minimize toxicity in these patients.",Unknown,1467345600.0,,"TL mentioned that from their experience with regimen, younger patients and/or those with lower disease burden tend to be the patients that develop imAEs. Perhaps patients with low burden disease need 1-2 doses vs all 4 and would minimize toxicity in these patients."
"During presentation at Highlights from ASCO meeting, TL commented that PD-L1 is useless biomarker for making treatment decisions. There are too many variables and unanswered questions. He referenced the -067 ORR data in PD-L1 negative patients and said you can't argue with 50% RR in met melanoma.",Unknown,1466827200.0,,"During presentation at Highlights from ASCO meeting, TL commented that PD-L1 is useless biomarker for making treatment decisions. There are too many variables and unanswered questions. He referenced the -067 ORR data in PD-L1 negative patients and said you can't argue with 50% RR in met melanoma."
"Academic TL does not feel it is appropriate to have an algorithm for melanoma. Treatment approach really depends on the individual patient-disease burden, comorbidities, etc. Preference is to start with I-O vs BRAF/MEK unless patient is BRAF mut with significant tumor burden requiring rapid response. Also commented that 1L use of immunotherapy followed by targeted tx seems to prolong the efficacy of the targeted agent.",Unknown,1460606400.0,,"Academic TL does not feel it is appropriate to have an algorithm for melanoma. Treatment approach really depends on the individual patient-disease burden, comorbidities, etc. Preference is to start with I-O vs BRAF/MEK unless patient is BRAF mut with significant tumor burden requiring rapid response. Also commented that 1L use of immunotherapy followed by targeted tx seems to prolong the efficacy of the targeted agent."
"Academic TL is not testing for PD-L1 and does not believe PD-L1 alone will provide what we need as a biomarker. In her opinion, there will be a biomarker panel (although not sure what it will look like or when) that could include immunoscore, cytokine profiles, etc that would inform treatment decisions",Unknown,1460606400.0,,"Academic TL is not testing for PD-L1 and does not believe PD-L1 alone will provide what we need as a biomarker. In her opinion, there will be a biomarker panel (although not sure what it will look like or when) that could include immunoscore, cytokine profiles, etc that would inform treatment decisions"
TL learned at a melanoma conference that different regimen doses were being studied in other tumor types. Several other attendees were surprised to hear this also. TL thought it was positive and that BMS should be communicating this more with respect to imAE management; may address concerns about toxicity of regimen,Unknown,1460606400.0,,TL learned at a melanoma conference that different regimen doses were being studied in other tumor types. Several other attendees were surprised to hear this also. TL thought it was positive and that BMS should be communicating this more with respect to imAE management; may address concerns about toxicity of regimen
"TL stated that seeing the OS data for -029 supports her use of adjuvant in the right patient. TL would prefer 3 mg/kg over 10 mg/kg but until data is available, the OS data is reassuring.",Unknown,1478404800.0,,"TL stated that seeing the OS data for -029 supports her use of adjuvant in the right patient. TL would prefer 3 mg/kg over 10 mg/kg but until data is available, the OS data is reassuring."
"TL commented that the OS data for -029 hasn't changed her opinion of Ipi in the adjuvant setting due to toxicity concerns. The irAEs can be 'life-changing'. Only use of 10 mg/kg has been in clinical trials; however, TL stated preference for IFN over Ipi in the S1404 study.",Unknown,1478145600.0,,"TL commented that the OS data for -029 hasn't changed her opinion of Ipi in the adjuvant setting due to toxicity concerns. The irAEs can be 'life-changing'. Only use of 10 mg/kg has been in clinical trials; however, TL stated preference for IFN over Ipi in the S1404 study."
Accrual has improved for S1404 following the amendment to add ipilimumab. More patients are receiving Ipi than HD IFN in this arm of the trial. Enrollment expected to complete in about a year with OS data expected fall/winter of 2018.,Unknown,1475208000.0,,Accrual has improved for S1404 following the amendment to add ipilimumab. More patients are receiving Ipi than HD IFN in this arm of the trial. Enrollment expected to complete in about a year with OS data expected fall/winter of 2018.
"Academic TL is not testing for PD-L1 but does believe it has a role in determining regimen vs monotherapy in specific patients where toxicity may be a concern (i.e. comorbidities, etc)",Unknown,1455598800.0,,"Academic TL is not testing for PD-L1 but does believe it has a role in determining regimen vs monotherapy in specific patients where toxicity may be a concern (i.e. comorbidities, etc)"
"Although site is participating in EA6134, TL doesn't support first line use of targeted therapies in melanoma",Unknown,1454907600.0,,"Although site is participating in EA6134, TL doesn't support first line use of targeted therapies in melanoma"
Local melanoma TL commented that fatigue is the most common toxicity in patients treated with nivo and most docs are not exactly sure how to manage it.,Unknown,1473393600.0,,Local melanoma TL commented that fatigue is the most common toxicity in patients treated with nivo and most docs are not exactly sure how to manage it.
"Local RCC TL told me that he uses Torisel first line in all of his RCC patients as he ""can get 2+years of response with that drug"" and then upon progression he uses pazopanib or nivo.",Unknown,1463716800.0,,"Local RCC TL told me that he uses Torisel first line in all of his RCC patients as he ""can get 2+years of response with that drug"" and then upon progression he uses pazopanib or nivo."
Local melanoma TL stated that he still prefers to use IO therapy before targeted agents in metastatic melanoma even though there appears to be a tail to the curve for targeted agents as well.,Unknown,1461729600.0,,Local melanoma TL stated that he still prefers to use IO therapy before targeted agents in metastatic melanoma even though there appears to be a tail to the curve for targeted agents as well.
Local melanoma TL commented that he views nivo and pembro as Pepsi vs Coke in terms of efficacy and toxicity. He stated that he currently has more Coke in his fridge (he uses pembro mostly). He said the Q3 vs Q2 is a pretty big deal.,Unknown,1461729600.0,,Local melanoma TL commented that he views nivo and pembro as Pepsi vs Coke in terms of efficacy and toxicity. He stated that he currently has more Coke in his fridge (he uses pembro mostly). He said the Q3 vs Q2 is a pretty big deal.
"Regional brain cancer TL commented that ""BMS is great at company sponsored studies but absolutely sucks at ISRs"".",Unknown,1461297600.0,,"Regional brain cancer TL commented that ""BMS is great at company sponsored studies but absolutely sucks at ISRs""."
