text,source_type,date,title,text
"NTL from podium spoke very positively of IO and Regimen (most data discussed from Nivo studies):
1)	We have 10y OS data with Yervoy and this will probably be even longer with Regimen.  Pts don't want a response ""they want to be on the tail in of the curve"".  He stated with Regimen and other IO combinations that ""hopefully we'll be talking to pts about a 30y OS plan in the future""
2)	Regimen 
a.	Presented data from -069 and -067 showing the PFS curve stating ""you don't need statistics to tell the difference in the curve favoring regimen"". 
b.	Toxicity is a concern and for older pts he chooses single agent PD1
c.	Regimen demonstrates similar activity in PDL1- pts
d.	TL stated uses Regimen every day in the clinic and has seen some spectacular results.  It's an ""excellent Regimen"".  Very potent regimen
3)	Stated the immune response is very rapid with PD1 agents and especially regimen
4)	PDL1 as biomarker:
a.	PDL1+ pts tend to have better responses across tumor types
b.	Showed Nivo OS curves in PDL+/- pts and stated most of the advantage is in PDL1+ pts.  However, he stated you ""don't want to withhold nivolumab treatment based on PDL1 expression levels bc PDL1- pts can have significant benefit as well""
c.	He stated mutational load may be the best biomarker
d.	Pts with high levels of CD8+ T cells in tumor microenvironment and invasive margins tend to have better responses
e.	No T cells within in tumor microenvironment pts don't seem to respond as well and this is an area ""we as researchers need to improve T cell recruitment with novel combinations of injectables/vaccines (referenced TVEC)
5)	Need to identify agents that have activity in checkpoint resistant pts  TL has had success with adoptive T cell transfer with approximately 30% RR although the RR drops in checkpoint resistant pts from 50% (checkpoint Naive) to about 30%.",Unknown,1459051200.0,,"NTL from podium spoke very positively of IO and Regimen (most data discussed from Nivo studies):
1)	We have 10y OS data with Yervoy and this will probably be even longer with Regimen.  Pts don't want a response ""they want to be on the tail in of the curve"".  He stated with Regimen and other IO combinations that ""hopefully we'll be talking to pts about a 30y OS plan in the future""
2)	Regimen 
a.	Presented data from -069 and -067 showing the PFS curve stating ""you don't need statistics to tell the difference in the curve favoring regimen"". 
b.	Toxicity is a concern and for older pts he chooses single agent PD1
c.	Regimen demonstrates similar activity in PDL1- pts
d.	TL stated uses Regimen every day in the clinic and has seen some spectacular results.  It's an ""excellent Regimen"".  Very potent regimen
3)	Stated the immune response is very rapid with PD1 agents and especially regimen
4)	PDL1 as biomarker:
a.	PDL1+ pts tend to have better responses across tumor types
b.	Showed Nivo OS curves in PDL+/- pts and stated most of the advantage is in PDL1+ pts.  However, he stated you ""don't want to withhold nivolumab treatment based on PDL1 expression levels bc PDL1- pts can have significant benefit as well""
c.	He stated mutational load may be the best biomarker
d.	Pts with high levels of CD8+ T cells in tumor microenvironment and invasive margins tend to have better responses
e.	No T cells within in tumor microenvironment pts don't seem to respond as well and this is an area ""we as researchers need to improve T cell recruitment with novel combinations of injectables/vaccines (referenced TVEC)
5)	Need to identify agents that have activity in checkpoint resistant pts  TL has had success with adoptive T cell transfer with approximately 30% RR although the RR drops in checkpoint resistant pts from 50% (checkpoint Naive) to about 30%."
"A Melanoma NTL from Boston, after hearing about the Atezo+MEK+BRAF data, suggested that this was an additive effect of PDL1 with the MEK/BRAF combo (from and ORR standpoint). He also said that Atezo has about 30-35% RR, which is lower than the anti-PD-1 (nivo or pembro) which have about a 40%+ RR.  Therefore, he implied that Nivo (or Pembro) plus MEK/BRAF triple may have a higher RR.",Unknown,1478494800.0,,"A Melanoma NTL from Boston, after hearing about the Atezo+MEK+BRAF data, suggested that this was an additive effect of PDL1 with the MEK/BRAF combo (from and ORR standpoint). He also said that Atezo has about 30-35% RR, which is lower than the anti-PD-1 (nivo or pembro) which have about a 40%+ RR.  Therefore, he implied that Nivo (or Pembro) plus MEK/BRAF triple may have a higher RR."
"A RTL shared that Q3w dosing vs Q2w dosing is a big deal as they don't have enough chairs or shortage of to administer IV infusion.  the RTL stated that ""if I can free up chair time with q3w dosing over q2w dosing, I will.""",Unknown,1462852800.0,,"A RTL shared that Q3w dosing vs Q2w dosing is a big deal as they don't have enough chairs or shortage of to administer IV infusion.  the RTL stated that ""if I can free up chair time with q3w dosing over q2w dosing, I will."""
"An RTL shared that while she appreciate the better PFS with Nivo/Ipi combo over nivo mono, and is impressed with Phase I OS data with combo, she argued that BMS still need to provide that Nivo/ipi combo has better OS outcome than Nivo followed by Ipi (or vice versa) in a sequential approach. The rationale for her argument is sequence has much lower toxicity then combo.",Unknown,1456894800.0,,"An RTL shared that while she appreciate the better PFS with Nivo/Ipi combo over nivo mono, and is impressed with Phase I OS data with combo, she argued that BMS still need to provide that Nivo/ipi combo has better OS outcome than Nivo followed by Ipi (or vice versa) in a sequential approach. The rationale for her argument is sequence has much lower toxicity then combo."
"A NTL from Texas (surgeon), shared that the future of melanoma  surgery is the combination of utilizing immunotherapy (either systemically, or locally) with surgery.",Unknown,1478404800.0,,"A NTL from Texas (surgeon), shared that the future of melanoma  surgery is the combination of utilizing immunotherapy (either systemically, or locally) with surgery."
"In speaking with a Melanoma RTL, he is surprised how many community TLs have embraced the Nivo + Ipi combo.  He was concerned that how many community MDs have stated that they used the regimen at full doses of both drugs (Nivo 3mg/kg + Ipi 3mg/kg), where he had to correct them on the appropriate Nivolumab dose for the combination is 1 mg/kg.",Unknown,1458187200.0,,"In speaking with a Melanoma RTL, he is surprised how many community TLs have embraced the Nivo + Ipi combo.  He was concerned that how many community MDs have stated that they used the regimen at full doses of both drugs (Nivo 3mg/kg + Ipi 3mg/kg), where he had to correct them on the appropriate Nivolumab dose for the combination is 1 mg/kg."
"A Melanoma RTL, In Boston, shared that Roche is doing a PD-L1 + MEK inhibitor study in melanoma, and while he can't break confidentiality agreements, he did say that BMS can read into the fact that the study is still open (hinting positive results).",Unknown,1458187200.0,,"A Melanoma RTL, In Boston, shared that Roche is doing a PD-L1 + MEK inhibitor study in melanoma, and while he can't break confidentiality agreements, he did say that BMS can read into the fact that the study is still open (hinting positive results)."
"An Academic TL shared that if a pt fails monotherapy PD-1 (either pembro or Nivo), they then add ipilimumab on top especially if the pt did not experience any AEs to monotherapy anti-PD-1 therapy.  The TL was hinting toward lack of toxicity equals 'not enough IO blockade' and hence they need to use combo IO in those pts.",Unknown,1457586000.0,,"An Academic TL shared that if a pt fails monotherapy PD-1 (either pembro or Nivo), they then add ipilimumab on top especially if the pt did not experience any AEs to monotherapy anti-PD-1 therapy.  The TL was hinting toward lack of toxicity equals 'not enough IO blockade' and hence they need to use combo IO in those pts."
"A NTL stated that he sees Pembro 2mg/kg and 2mg/kg as the same.  When asked, what data makes him feel that they are the same, he stated, ""because Toni Ribas is the lead of that Pembro study and based on him reputation (knowing him), I trust him!""",Unknown,1456117200.0,,"A NTL stated that he sees Pembro 2mg/kg and 2mg/kg as the same.  When asked, what data makes him feel that they are the same, he stated, ""because Toni Ribas is the lead of that Pembro study and based on him reputation (knowing him), I trust him!"""
"A melanoma NTL stated that ""while I agree that Nivo/Ipi combo has a better response rate, the OS rate for PD-1's is similar to that of Phase II Nivo/Ipi OS (Checkmate 069) and I don't want to expose my pts to additional toxicities"".",Unknown,1477627200.0,,"A melanoma NTL stated that ""while I agree that Nivo/Ipi combo has a better response rate, the OS rate for PD-1's is similar to that of Phase II Nivo/Ipi OS (Checkmate 069) and I don't want to expose my pts to additional toxicities""."
"An RTL from Boston shared with that instead of doing a Nivo3/Ipi1 vs. Nivo1/Ipi3 study, BMS needs to add another arm that looks at Nivo 3 q2wks, and Ipi 1 mg q 6 weeks.  This will make the study more attractive in the 1st line setting.",Unknown,1476072000.0,,"An RTL from Boston shared with that instead of doing a Nivo3/Ipi1 vs. Nivo1/Ipi3 study, BMS needs to add another arm that looks at Nivo 3 q2wks, and Ipi 1 mg q 6 weeks.  This will make the study more attractive in the 1st line setting."
"An RTL from an academic center in Boston informed me they prefer monotherapy IO sequencing over starting a pt on the Regimen.  She stated that ""at least this way we can keep the toxicity low and only need to use ipimumab in about 50% of the pts that don't response to PD-1 inhibitor.""  She added that they ""rarely use Nivo/Ipi combo"" for their 1st line Met Melanoma pts.",Unknown,1470888000.0,,"An RTL from an academic center in Boston informed me they prefer monotherapy IO sequencing over starting a pt on the Regimen.  She stated that ""at least this way we can keep the toxicity low and only need to use ipimumab in about 50% of the pts that don't response to PD-1 inhibitor.""  She added that they ""rarely use Nivo/Ipi combo"" for their 1st line Met Melanoma pts."
"A NTL for melanoma stated that for 50% of his 1st line met melanoma pts, he uses Ipi/Nivo Combo and for the other 50% he sequences the IO agents as monotherapy.  About 6 months ago, the same TL was using Nivo/Ipi combo in about 70-75%  of his 1st line met melanoma pts.",Unknown,1470715200.0,,"A NTL for melanoma stated that for 50% of his 1st line met melanoma pts, he uses Ipi/Nivo Combo and for the other 50% he sequences the IO agents as monotherapy.  About 6 months ago, the same TL was using Nivo/Ipi combo in about 70-75%  of his 1st line met melanoma pts."
Regional melanoma TL from Boston mentioned that melanoma pt receiving combination therapy experienced osteoblasts can activity in bone lyric lesions. TL will be sharing this experience in a podium presentation in the near future.,Unknown,1462852800.0,,Regional melanoma TL from Boston mentioned that melanoma pt receiving combination therapy experienced osteoblasts can activity in bone lyric lesions. TL will be sharing this experience in a podium presentation in the near future.
"Local NP TL for melanoma at Boston institution shared that when using Ipi in combo with pd1 inhibitor, ""we stick with Nivolumab because it was dosed at 1mg/kg (as oppose to 3mg/kg)...and we can't extrapolate what that would be in Pembro dose.""  She was inferring that if there was any data available with Pembro/Ipi combo dosing, then they would more likely switch to using Pembro over Nivo.",Unknown,1462852800.0,,"Local NP TL for melanoma at Boston institution shared that when using Ipi in combo with pd1 inhibitor, ""we stick with Nivolumab because it was dosed at 1mg/kg (as oppose to 3mg/kg)...and we can't extrapolate what that would be in Pembro dose.""  She was inferring that if there was any data available with Pembro/Ipi combo dosing, then they would more likely switch to using Pembro over Nivo."
Local NP TL for melanoma at Boston institution requested that BMS generate data on Nivo Q3w maintenance data after the 4 doses of combination induction phase of regimen.,Unknown,1462852800.0,,Local NP TL for melanoma at Boston institution requested that BMS generate data on Nivo Q3w maintenance data after the 4 doses of combination induction phase of regimen.
"Regional melanoma TL from the Boston area spoke highly of Nivolumab/Ipi combination. He shared that after completing 4 doses of regimen, he has administered 1 additional dose of Ipi 3 mg/kg on top of Nivolumab maintenance. He has done this for 2 patients.",Unknown,1462852800.0,,"Regional melanoma TL from the Boston area spoke highly of Nivolumab/Ipi combination. He shared that after completing 4 doses of regimen, he has administered 1 additional dose of Ipi 3 mg/kg on top of Nivolumab maintenance. He has done this for 2 patients."
"An LTL at an smaller academic institution agrees that the CheckMate 67 efficacy data looks great with 60% ORR with Nivo+Ipi, but refuses to use it because of the safety profile. She state all that all Regimen pts need to be treat at/by a Large Academic Institution, but she does not refer her pts to those Academic Institutions. She prefer to use Anti--PD-1 (Nivo>Pembro) for her melanoma pts.",Unknown,1460692800.0,,"An LTL at an smaller academic institution agrees that the CheckMate 67 efficacy data looks great with 60% ORR with Nivo+Ipi, but refuses to use it because of the safety profile. She state all that all Regimen pts need to be treat at/by a Large Academic Institution, but she does not refer her pts to those Academic Institutions. She prefer to use Anti--PD-1 (Nivo>Pembro) for her melanoma pts."
"A RTL from Maine, specializing in Melanoma, after seeing the OS data from CA184-029, stated that while he was aware of the Ipi 10 mg/kg data in the adjuvant melanoma setting (improved RFS), he truly was impressed by the improved OS rates.  He added that he will start offering Yervoy (not sure if at 3mg or 10mg) more to his adjuvant melanoma pts. He also commended that this would impact what he offers to the Pembrolizumab Adjuvant study.",Unknown,1480309200.0,,"A RTL from Maine, specializing in Melanoma, after seeing the OS data from CA184-029, stated that while he was aware of the Ipi 10 mg/kg data in the adjuvant melanoma setting (improved RFS), he truly was impressed by the improved OS rates.  He added that he will start offering Yervoy (not sure if at 3mg or 10mg) more to his adjuvant melanoma pts. He also commended that this would impact what he offers to the Pembrolizumab Adjuvant study."
Melanoma RTL at an academic center informed me that their institution would rather use IFN-alpha over Ipilimumab 10mg/kg for their high-risk recurrence Adjuvant Melanoma pts.,Unknown,1470888000.0,,Melanoma RTL at an academic center informed me that their institution would rather use IFN-alpha over Ipilimumab 10mg/kg for their high-risk recurrence Adjuvant Melanoma pts.
An NTL stated that he still believe that ipilimumab should be used in all melanoma at some point (either as combo or sequence) because it's the only IO agent that has shown long term durable survival.,Unknown,1455858000.0,,An NTL stated that he still believe that ipilimumab should be used in all melanoma at some point (either as combo or sequence) because it's the only IO agent that has shown long term durable survival.
"A RTL in melanoma from Boston, is prospectively looking to coordinate vetaligo with efficacy. Vetaligo is mostly seen in melanoma pts that have been treated with anti CTLA4 or PD-1/L1 therapy.",Unknown,1478404800.0,,"A RTL in melanoma from Boston, is prospectively looking to coordinate vetaligo with efficacy. Vetaligo is mostly seen in melanoma pts that have been treated with anti CTLA4 or PD-1/L1 therapy."
"An melanoma academic TL shared that for their high risk progression adjuvant melanoma pts, if additional systemic therapy was to be provided in the adjuvant setting, they will use PD-1 inhibitor over Ipilimumab (3mg/kg or 10mg/kg).",Unknown,1470888000.0,,"An melanoma academic TL shared that for their high risk progression adjuvant melanoma pts, if additional systemic therapy was to be provided in the adjuvant setting, they will use PD-1 inhibitor over Ipilimumab (3mg/kg or 10mg/kg)."
"An LTL from community/academic location, shared that she used nivolumab (over pembro) in the 1st line metastatic melanoma setting.  upon progression, she will use 2nd line.  With regards to Regimen for 1st line (or any-line), she said the toxicity is too high and sends those pts into academic locations in Boston.",Unknown,1461556800.0,,"An LTL from community/academic location, shared that she used nivolumab (over pembro) in the 1st line metastatic melanoma setting.  upon progression, she will use 2nd line.  With regards to Regimen for 1st line (or any-line), she said the toxicity is too high and sends those pts into academic locations in Boston."
LTL and Empliciti speaker stated that good data with Daratumumab may make Elotuzumab more challenging.,Unknown,1465876800.0,,LTL and Empliciti speaker stated that good data with Daratumumab may make Elotuzumab more challenging.
"Discussed aggressive versus non aggressive relapse with RTL for MM at a large academic center, he confirmed that in an aggressive relapse he would likely not choose Elotuzumab but would consider Elo in a slow relapse.",Unknown,1464235200.0,,"Discussed aggressive versus non aggressive relapse with RTL for MM at a large academic center, he confirmed that in an aggressive relapse he would likely not choose Elotuzumab but would consider Elo in a slow relapse."
"During a meeting to reactively discuss ESMO 2016 melanoma data, a RAI/advisor to a melanoma NCCN panelist shared the following unsolicited insights:
* Had only limited interest in Sznol's pooled analysis of regimen's safety profile and in Martin-Algera's poster on reduced infusion time for ipi+nivo combo (CA209-038).",Unknown,1477368000.0,,"During a meeting to reactively discuss ESMO 2016 melanoma data, a RAI/advisor to a melanoma NCCN panelist shared the following unsolicited insights:
* Had only limited interest in Sznol's pooled analysis of regimen's safety profile and in Martin-Algera's poster on reduced infusion time for ipi+nivo combo (CA209-038)."
"After reviewing Long GV et al poster on PD-L1 expression as a predictor of regimen and nivo efficacy in CM 066, 067, and 069 during a reactive discussion, a RTL/advisor to an NCCN melanoma panelist, who previously considered the regimen to be too toxic for many patients in 1L melanoma setting, concluded he would no longer test for PD-L1 expression and use the regimen in all PS 0-1 patients, based on relatively low prevalence of PD-L1 expression 5%, lack of PD-L1 testing predictive value (based on sensitivity/specificity/PPV/NPV table), and numerically higher ORR with regimen vs. nivo in high expressors.",Unknown,1476331200.0,,"After reviewing Long GV et al poster on PD-L1 expression as a predictor of regimen and nivo efficacy in CM 066, 067, and 069 during a reactive discussion, a RTL/advisor to an NCCN melanoma panelist, who previously considered the regimen to be too toxic for many patients in 1L melanoma setting, concluded he would no longer test for PD-L1 expression and use the regimen in all PS 0-1 patients, based on relatively low prevalence of PD-L1 expression 5%, lack of PD-L1 testing predictive value (based on sensitivity/specificity/PPV/NPV table), and numerically higher ORR with regimen vs. nivo in high expressors."
"A regional AI for melanoma at an academic institution in the HSL South territory shared the following unsolicited insight about nivo+ipi regimen for advanced melanoma:
	Has used the regimen in several patients with autoimmune diseases, typically with only minor safety consequences. One patient developed a major arthritis flare; this patient insisted they wanted to continue their IO therapy no matter what.",Unknown,1472788800.0,,"A regional AI for melanoma at an academic institution in the HSL South territory shared the following unsolicited insight about nivo+ipi regimen for advanced melanoma:
	Has used the regimen in several patients with autoimmune diseases, typically with only minor safety consequences. One patient developed a major arthritis flare; this patient insisted they wanted to continue their IO therapy no matter what."
"A regional AI for melanoma at an academic institution in the HSL South territory shared the following unsolicited insight about nivo+ipi regimen for advanced melanoma in community setting:
	Has trained 24 community oncologists in the use of nivo+ipi for advanced melanoma. Believes that all of them are ready to or have already treated their first patient(s) with the regimen.
	Emphasis is on early detection and management of IMARs. ""I scare the hell out of them"" ""Half of patients do really, really well and tolerate the regimen without any problem, but this is something I carefully avoid to say to community oncologists"". What is dangerous is that the most serious AEs have an insidious onset. Main fear is colitis leading to intestinal perforation (""something you really do not want to see"").",Unknown,1472788800.0,,"A regional AI for melanoma at an academic institution in the HSL South territory shared the following unsolicited insight about nivo+ipi regimen for advanced melanoma in community setting:
	Has trained 24 community oncologists in the use of nivo+ipi for advanced melanoma. Believes that all of them are ready to or have already treated their first patient(s) with the regimen.
	Emphasis is on early detection and management of IMARs. ""I scare the hell out of them"" ""Half of patients do really, really well and tolerate the regimen without any problem, but this is something I carefully avoid to say to community oncologists"". What is dangerous is that the most serious AEs have an insidious onset. Main fear is colitis leading to intestinal perforation (""something you really do not want to see"")."
"A regional AI for melanoma at an academic institution in the HSL South territory shared the following unsolicited insight about nivo+ipi regimen for advanced melanoma in community setting:
	Main concern is not with community oncologists any more, but with ER doctors providing care to patients presenting with an IMAR at night or during the weekend.",Unknown,1472788800.0,,"A regional AI for melanoma at an academic institution in the HSL South territory shared the following unsolicited insight about nivo+ipi regimen for advanced melanoma in community setting:
	Main concern is not with community oncologists any more, but with ER doctors providing care to patients presenting with an IMAR at night or during the weekend."
"A regional AI for melanoma at an academic institution in the HSL South territory shared the following unsolicited insight about nivo+ipi regimen for advanced melanoma:
	Regimen is therapy of choice in 1L setting for virtually all patients with unresectable/metastatic melanoma, regardless of PD-L1 expression level and irrespective of BRAF status.
	Still prefers nivo single agent for elderly patients, including older healthy patients. Admitted not being aware that tolerability of regimen in elderly patients is supported by data.",Unknown,1472788800.0,,"A regional AI for melanoma at an academic institution in the HSL South territory shared the following unsolicited insight about nivo+ipi regimen for advanced melanoma:
	Regimen is therapy of choice in 1L setting for virtually all patients with unresectable/metastatic melanoma, regardless of PD-L1 expression level and irrespective of BRAF status.
	Still prefers nivo single agent for elderly patients, including older healthy patients. Admitted not being aware that tolerability of regimen in elderly patients is supported by data."
"An academic, regionally-recognized melanoma AI, speaker for Merck, and advisor to a surgeon NCCN panelist, shared the following unsolicited insights:
Many community oncologists are scared of the ipi/nivo regimen or got burned. They typically start their patients on single-agent nivo/pembro therapy. Greater education efforts are needed. ""Although this is impossible, every oncologists should treat 10 patients with ipi monotherapy and 10 patients with nivo monotherapy before being allowed to prescribe the ipi-nivo regimen to anybody"".",Unknown,1463630400.0,,"An academic, regionally-recognized melanoma AI, speaker for Merck, and advisor to a surgeon NCCN panelist, shared the following unsolicited insights:
Many community oncologists are scared of the ipi/nivo regimen or got burned. They typically start their patients on single-agent nivo/pembro therapy. Greater education efforts are needed. ""Although this is impossible, every oncologists should treat 10 patients with ipi monotherapy and 10 patients with nivo monotherapy before being allowed to prescribe the ipi-nivo regimen to anybody""."
