text,source_type,date,title,text
"Discussion with RTL at major academic institution.  Unprompted discussion around comparing the 2 currently available PD-1 inhibitors.
""Nivo = human and pembro = humanized, pembro much more toxic - FACT! (specifically mentioned colitis and anemia/fatigue) Still many questions around the pembro dose although admitted trial designs much different, not an apples to apples comparison.  Feels the q3w dosing favors using pembro"".",Unknown,1454994000.0,,"Discussion with RTL at major academic institution.  Unprompted discussion around comparing the 2 currently available PD-1 inhibitors.
""Nivo = human and pembro = humanized, pembro much more toxic - FACT! (specifically mentioned colitis and anemia/fatigue) Still many questions around the pembro dose although admitted trial designs much different, not an apples to apples comparison.  Feels the q3w dosing favors using pembro""."
Melanoma patient with brain mets sent to academic institution for Nivo clinical trial.  MD commented how well the patient is doing as well as tolerating the medication nicely.,Unknown,1472788800.0,,Melanoma patient with brain mets sent to academic institution for Nivo clinical trial.  MD commented how well the patient is doing as well as tolerating the medication nicely.
Perceptions that community physicians do not have the necessary education on toxicity management nor the experience to confidently use regimen in the community setting.,Unknown,1473998400.0,,Perceptions that community physicians do not have the necessary education on toxicity management nor the experience to confidently use regimen in the community setting.
"Spoke to one of my TLs today about ASCO, her comments were:  While the 069 data presented at ASCO is intriguing, and 71 % survival at 2 years is impressive, I'm not inclined to believe it because the patients selected for that trial are the exact opposite of the patients I see in clinical practice.",Unknown,1468296000.0,,"Spoke to one of my TLs today about ASCO, her comments were:  While the 069 data presented at ASCO is intriguing, and 71 % survival at 2 years is impressive, I'm not inclined to believe it because the patients selected for that trial are the exact opposite of the patients I see in clinical practice."
"High disease burden Phase I immunotherapy TL:  ""BMS needs to consider combining CTLA-4/PD-1 in same vial moving forward as many sponsors conducting combined I/O compounds are moving towards combining both compounds in the same vial.  Obviously once you guys get the doses for Ipi/Nivo right""",Unknown,1462507200.0,,"High disease burden Phase I immunotherapy TL:  ""BMS needs to consider combining CTLA-4/PD-1 in same vial moving forward as many sponsors conducting combined I/O compounds are moving towards combining both compounds in the same vial.  Obviously once you guys get the doses for Ipi/Nivo right"""
A regional TL was curious about whether we were investigating the combination of Imlygic and Nivolumab for melanoma patients. He commented that he had a good response in a melanoma patient treated with Imlygic followed by Nivolumab.,Unknown,1477627200.0,,A regional TL was curious about whether we were investigating the combination of Imlygic and Nivolumab for melanoma patients. He commented that he had a good response in a melanoma patient treated with Imlygic followed by Nivolumab.
"A regional TL is treating an 89 year-old melanoma patient with the combination of Opdivo and Yervoy, but is only using Yervoy at 1 mg/kg every 6 weeks for 4 doses. He is aware there is no data to support this in melanoma, but thinks this dosing schedule may be less toxic for elderly patients.",Unknown,1481086800.0,,"A regional TL is treating an 89 year-old melanoma patient with the combination of Opdivo and Yervoy, but is only using Yervoy at 1 mg/kg every 6 weeks for 4 doses. He is aware there is no data to support this in melanoma, but thinks this dosing schedule may be less toxic for elderly patients."
"I met with a melanoma NTL and he brought up the NYT article on IO AEs. He shared that he thought it was a favorable article at the end but it was not a ""balance of what we are up against when we are dealing with the kind of disease that kills everyone."" He shared that the article did not get at the fact that a certain amount of toxicity is the point and that generally toxicity manifestation can shorten therapy time.  He added that if colitis is seen, a few days on steroids followed by a dose of infliximab is enough to take care of it. Diabetes and endocrine issues can effect patients long-term but they are not the end of the world. He did express concern that there is under-reported joint pain and fatigue that can be seen with a PD-1 monotherapy that can last for 6- 12 months after treatment. 

He shared that there is a need for strong education of patients and that education for oncologists is needed in educating patients. He further shared a recent discussion with a community oncologist who does not see his regimen patients every three weeks (they are seen by his nurse after the first dose). He was shocked by this and emphasized the importance of not only seeing the patient before each dose but also between the 2nd and 3rd dose. 

The NYT article seemed to strike a nerve with him and he wants to become more involved in safety management education including education at ERs through the hospital system with which he is associated.",Unknown,1481173200.0,,"I met with a melanoma NTL and he brought up the NYT article on IO AEs. He shared that he thought it was a favorable article at the end but it was not a ""balance of what we are up against when we are dealing with the kind of disease that kills everyone."" He shared that the article did not get at the fact that a certain amount of toxicity is the point and that generally toxicity manifestation can shorten therapy time.  He added that if colitis is seen, a few days on steroids followed by a dose of infliximab is enough to take care of it. Diabetes and endocrine issues can effect patients long-term but they are not the end of the world. He did express concern that there is under-reported joint pain and fatigue that can be seen with a PD-1 monotherapy that can last for 6- 12 months after treatment. 

He shared that there is a need for strong education of patients and that education for oncologists is needed in educating patients. He further shared a recent discussion with a community oncologist who does not see his regimen patients every three weeks (they are seen by his nurse after the first dose). He was shocked by this and emphasized the importance of not only seeing the patient before each dose but also between the 2nd and 3rd dose. 

The NYT article seemed to strike a nerve with him and he wants to become more involved in safety management education including education at ERs through the hospital system with which he is associated."
Melanoma national TL on the NCCN panel shared that he is interested in the nivo3/ipi1 dosing but that he is not convinced that it will be as efficacious. He shared that he felt that the lung dosing that is being used in phase 3 trial is based on safety rather than efficacy. He also shared that a major data gap for him is PD-1 inhibitor failures going onto ipi/nivo therapy and is interested in seeing data when it comes out. He further shared that he has case studies of patients being treated this way and he has been able to elicit responses.,Unknown,1479704400.0,,Melanoma national TL on the NCCN panel shared that he is interested in the nivo3/ipi1 dosing but that he is not convinced that it will be as efficacious. He shared that he felt that the lung dosing that is being used in phase 3 trial is based on safety rather than efficacy. He also shared that a major data gap for him is PD-1 inhibitor failures going onto ipi/nivo therapy and is interested in seeing data when it comes out. He further shared that he has case studies of patients being treated this way and he has been able to elicit responses.
"Community TL who sees a lot of melanoma patients shared that the ipi adjuvant data has ""put them on the spot"". He is concerned about the toxicities and did not discuss it as a viable option with his patients. Now that there is OS data, he feels obliged to inform them and offer them the option.",Unknown,1479704400.0,,"Community TL who sees a lot of melanoma patients shared that the ipi adjuvant data has ""put them on the spot"". He is concerned about the toxicities and did not discuss it as a viable option with his patients. Now that there is OS data, he feels obliged to inform them and offer them the option."
NTL in melanoma shared that about 70% of patients who respond to PD1 inhibitors maintain a response which is similar to what is seen with ipi/nivo combination. Those patients who show acquired resistance are an important area of focus.,Unknown,1478926800.0,,NTL in melanoma shared that about 70% of patients who respond to PD1 inhibitors maintain a response which is similar to what is seen with ipi/nivo combination. Those patients who show acquired resistance are an important area of focus.
NTL shared that it is very difficult to enroll patients onto melanoma trials that required being P-1/L1 Naive because every patient who he receives as a referral has already been treated in the community with checkpoint inhibitors.,Unknown,1477281600.0,,NTL shared that it is very difficult to enroll patients onto melanoma trials that required being P-1/L1 Naive because every patient who he receives as a referral has already been treated in the community with checkpoint inhibitors.
NTL in melanoma shared that the 169 study validated what he thought all along about ipi dosing. He further shared that he didn't know how relevant the data was going to be now but that a higher dose of ipi might be considered as the dose in future combination trials with non-PD-1 compounds.,Unknown,1476676800.0,,NTL in melanoma shared that the 169 study validated what he thought all along about ipi dosing. He further shared that he didn't know how relevant the data was going to be now but that a higher dose of ipi might be considered as the dose in future combination trials with non-PD-1 compounds.
Academic NTL in melanoma shared that he used TVec in front line patients with less burden of disease but the big question is when you stop treating. He is not participating in the pembro plus TVec study but will send patients to a site that has it.,Unknown,1475294400.0,,Academic NTL in melanoma shared that he used TVec in front line patients with less burden of disease but the big question is when you stop treating. He is not participating in the pembro plus TVec study but will send patients to a site that has it.
"Academic NTL in melanoma shared that he had a patient who was treated with and progressed after ipi monotherapy, BRAF/MEK, and IL-2. The patient developed brain mets and was treated with ipi/nivo and has a complete response in the brain.",Unknown,1475294400.0,,"Academic NTL in melanoma shared that he had a patient who was treated with and progressed after ipi monotherapy, BRAF/MEK, and IL-2. The patient developed brain mets and was treated with ipi/nivo and has a complete response in the brain."
"Community LTL pharmacist shared that they do not always use the regimen in metastatic melanoma patients because of toxicity management. They assess the patient for compliance and communication skills. Additionally, the perceived cost appeared to be a lot and the practice was not always willing to take the risk of reimbursement.",Unknown,1473912000.0,,"Community LTL pharmacist shared that they do not always use the regimen in metastatic melanoma patients because of toxicity management. They assess the patient for compliance and communication skills. Additionally, the perceived cost appeared to be a lot and the practice was not always willing to take the risk of reimbursement."
"Academic RTL shared that when she is considering new treatment paradigms, combination therapy is the direction to go in and that PD-1 therapy should be the backbone for all combinations. She shared that while not everyone responds to it, it is tolerable. She also shared that she is excited to see the data with nivo 3/ ipi 1 in melanoma and also wanted to take a closer look at the NSCLC 012 dosing data.",Unknown,1473912000.0,,"Academic RTL shared that when she is considering new treatment paradigms, combination therapy is the direction to go in and that PD-1 therapy should be the backbone for all combinations. She shared that while not everyone responds to it, it is tolerable. She also shared that she is excited to see the data with nivo 3/ ipi 1 in melanoma and also wanted to take a closer look at the NSCLC 012 dosing data."
Academic melanoma RTL during an institutional ASCO review where each tumor type is given 10 minutes shared avelumab Merkel cell data and the CM067 data. He shared that single agent Nivolumab is not the ideal first line choice and he was curious about what the tail-end of the long-term PFS was going to look like.,Unknown,1467950400.0,,Academic melanoma RTL during an institutional ASCO review where each tumor type is given 10 minutes shared avelumab Merkel cell data and the CM067 data. He shared that single agent Nivolumab is not the ideal first line choice and he was curious about what the tail-end of the long-term PFS was going to look like.
Academic NTL in melanoma shared that RT in combination with anti-PD-1 agents is not the correct combination for an abscopal effect. Radiation creates an inflammatory effect and induces PD-L1 expression but a response is seen only at the lesion that has been irradiated. He shared that the best effect on tumor reduction was when about 30% of the normal dose was used.,Unknown,1467950400.0,,Academic NTL in melanoma shared that RT in combination with anti-PD-1 agents is not the correct combination for an abscopal effect. Radiation creates an inflammatory effect and induces PD-L1 expression but a response is seen only at the lesion that has been irradiated. He shared that the best effect on tumor reduction was when about 30% of the normal dose was used.
"Academic NTL in melanoma shared that he prefers to use the regimen in treating most patients and that he is suspicious of a ""kinder, gentler approach"" to treatment that is being investigated. He further shared that he is interested in seeing GMCSF data in combination with ipi/nivo with long-term follow up to see whether toxicities might be reduced. He also shared that he feels that there is a data gap in patients who fail ipi/nivo and that giving more doses would be a good way to elicit a response. He also shared that he thought that the nano-strings approach to understanding which patients would respond to PD-1 therapy looked promising.",Unknown,1467950400.0,,"Academic NTL in melanoma shared that he prefers to use the regimen in treating most patients and that he is suspicious of a ""kinder, gentler approach"" to treatment that is being investigated. He further shared that he is interested in seeing GMCSF data in combination with ipi/nivo with long-term follow up to see whether toxicities might be reduced. He also shared that he feels that there is a data gap in patients who fail ipi/nivo and that giving more doses would be a good way to elicit a response. He also shared that he thought that the nano-strings approach to understanding which patients would respond to PD-1 therapy looked promising."
Community TL was interested in data in melanoma patients treated with Nivolumab who had previously been treated with ipilimumab and pembrolizumab. The patient was not interested in the regimen.,Unknown,1462939200.0,,Community TL was interested in data in melanoma patients treated with Nivolumab who had previously been treated with ipilimumab and pembrolizumab. The patient was not interested in the regimen.
A community TL shared that a patient experienced a polyvariant autoimmune neuropathy on pembrolizumab and the patient had still not resolved after 3 weeks of corticosteroids. He was concerned that neuropathy may be more common than reported and is going to keep an eye on it.,Unknown,1459137600.0,,A community TL shared that a patient experienced a polyvariant autoimmune neuropathy on pembrolizumab and the patient had still not resolved after 3 weeks of corticosteroids. He was concerned that neuropathy may be more common than reported and is going to keep an eye on it.
"During a conversation with two regional melanoma TLs, they discussed the recent NEJM article about a patient who rejected a transplanted kidney after treatment with a PD-1 agent. One TL shared that he had had a similar experience with a patient and the other shared that he would still offer the transplant patient PD-1 therapy if there were no other options. They both agreed that it did not seem that ipilimumab caused transplant rejection. 
The same article was mentioned on a different day by a community melanoma TL who shared a similar perception.",Unknown,1458532800.0,,"During a conversation with two regional melanoma TLs, they discussed the recent NEJM article about a patient who rejected a transplanted kidney after treatment with a PD-1 agent. One TL shared that he had had a similar experience with a patient and the other shared that he would still offer the transplant patient PD-1 therapy if there were no other options. They both agreed that it did not seem that ipilimumab caused transplant rejection. 
The same article was mentioned on a different day by a community melanoma TL who shared a similar perception."
"regional melanoma TL shared that he had just finished reviewing a journal article a retrospective analysis of uveal melanoma patients treated with the regimen. He shared that the response rates were about 5-10% which he shared was typical of this disease state. 
He also shared that he has read case reports and has experience with patients who have had responses on monotherapy IO agents and have been off of therapy only to progress. These patients are re-exposed to therapy (in some cases the regimen) and can have responses. He shared that the response rates of re-exposed patients is a major question in the field.",Unknown,1458532800.0,,"regional melanoma TL shared that he had just finished reviewing a journal article a retrospective analysis of uveal melanoma patients treated with the regimen. He shared that the response rates were about 5-10% which he shared was typical of this disease state. 
He also shared that he has read case reports and has experience with patients who have had responses on monotherapy IO agents and have been off of therapy only to progress. These patients are re-exposed to therapy (in some cases the regimen) and can have responses. He shared that the response rates of re-exposed patients is a major question in the field."
Academic melanoma TL who is on the NCCN panel shared that he has seen responses in patients who have progressed on or after IO monotherapy (PD-1 inhibitors and ipi) and then received the regimen as a second or third line therapy. He sees many referrals from community HCPs and is comfortable re-challenging them.,Unknown,1456894800.0,,Academic melanoma TL who is on the NCCN panel shared that he has seen responses in patients who have progressed on or after IO monotherapy (PD-1 inhibitors and ipi) and then received the regimen as a second or third line therapy. He sees many referrals from community HCPs and is comfortable re-challenging them.
"Academic TL shared that he routinely uses PD-1 inhibitors as a monotherapy in the first line in melanoma patients. If a patient does not have any SAEs and if the patient does not have a complete response, then he will add in ipi. He has seen responses develop but he did not know the efficacy. He shared that he felt that he was avoiding unnecessary toxicities in patients.",Unknown,1456894800.0,,"Academic TL shared that he routinely uses PD-1 inhibitors as a monotherapy in the first line in melanoma patients. If a patient does not have any SAEs and if the patient does not have a complete response, then he will add in ipi. He has seen responses develop but he did not know the efficacy. He shared that he felt that he was avoiding unnecessary toxicities in patients."
Community HCP shared that he continued patient on Nivolumab monotherapy after discontinuing regimen due to a grade 3 colitis. Patient's response is continuing and patient did not have re-flare of colitis.,Unknown,1467950400.0,,Community HCP shared that he continued patient on Nivolumab monotherapy after discontinuing regimen due to a grade 3 colitis. Patient's response is continuing and patient did not have re-flare of colitis.
"Over the past two weeks, at least three community TLs have mentioned their interest in using or their experience with T-VEC. All three were familiar with and mentioned the data in combination with ipi.",Unknown,1456894800.0,,"Over the past two weeks, at least three community TLs have mentioned their interest in using or their experience with T-VEC. All three were familiar with and mentioned the data in combination with ipi."
NTL in melanoma shared that the biggest unmet medical need in melanoma was in understanding therapies in refractory patients. He shared that research will not progress for combination therapies because trials will all look at treatment-Naive patients.,Unknown,1481605200.0,,NTL in melanoma shared that the biggest unmet medical need in melanoma was in understanding therapies in refractory patients. He shared that research will not progress for combination therapies because trials will all look at treatment-Naive patients.
"RTL shared that he was interested in testing for PD-L1 in the melanoma patient population for regimen and using monotherapy in the PD-L1 expressing group based on the lack of differentiation in PFS in the 067 data to avoid ""unnecessary"" treatment and toxicity exposure. He shared that he hasn't done it yet because no one seems to be testing for melanoma patients. Data that seemed to resonate with him was RR, MOA of ipi, and that OS has not yet been reported.",Unknown,1477713600.0,,"RTL shared that he was interested in testing for PD-L1 in the melanoma patient population for regimen and using monotherapy in the PD-L1 expressing group based on the lack of differentiation in PFS in the 067 data to avoid ""unnecessary"" treatment and toxicity exposure. He shared that he hasn't done it yet because no one seems to be testing for melanoma patients. Data that seemed to resonate with him was RR, MOA of ipi, and that OS has not yet been reported."
A local community TL who does research shared that they test for PDL-1 in all of their melanoma patients but that they do not make treatment decisions based on it. They also test for BRAF mutational status but use other parameters such as bulk and aggressiveness of disease to determine treatment therapies.,Unknown,1462334400.0,,A local community TL who does research shared that they test for PDL-1 in all of their melanoma patients but that they do not make treatment decisions based on it. They also test for BRAF mutational status but use other parameters such as bulk and aggressiveness of disease to determine treatment therapies.
"Community TL who is known as a referral for IL-2 treatment, shared that he has not used adjuvant ipi yet but that they just opened up the pembro adjuvant SWOG trial. He shared that if a patient is randomized to the ipi/IFN arm, he plans to put the patient on ipi to gain experience.",Unknown,1479704400.0,,"Community TL who is known as a referral for IL-2 treatment, shared that he has not used adjuvant ipi yet but that they just opened up the pembro adjuvant SWOG trial. He shared that if a patient is randomized to the ipi/IFN arm, he plans to put the patient on ipi to gain experience."
Community RTL shared that he likes seeing the OS benefit in adjuvant melanoma but that he has used the 10 mg dosing twice and both patients experienced severe AEs. He was not planning on using it again until the SWOG adjuvant data was available.,Unknown,1478494800.0,,Community RTL shared that he likes seeing the OS benefit in adjuvant melanoma but that he has used the 10 mg dosing twice and both patients experienced severe AEs. He was not planning on using it again until the SWOG adjuvant data was available.
Community TL was very interested in seeing the melanoma adjuvant data and felt that the OS benefit would help him explain the treatment to patients,Unknown,1477713600.0,,Community TL was very interested in seeing the melanoma adjuvant data and felt that the OS benefit would help him explain the treatment to patients
RTL in melanoma was following the ESMO melanoma data and will continue to use 10 mg dosing in the adjuvant setting unless the E1609 data shows that 3 mg is similar in PFS. He shared that he has mixed feelings using adjuvant ipi because of the toxicities but he shares all the data with his patients and that most choose to go on ipi.,Unknown,1476676800.0,,RTL in melanoma was following the ESMO melanoma data and will continue to use 10 mg dosing in the adjuvant setting unless the E1609 data shows that 3 mg is similar in PFS. He shared that he has mixed feelings using adjuvant ipi because of the toxicities but he shares all the data with his patients and that most choose to go on ipi.
NTL in melanoma shared that the most exciting data to come out of ESMO was the ipi adjuvant data. He shared that he was thrilled to see the improvement in OS and that this would give him and his patients confidence to continue using it.,Unknown,1476676800.0,,NTL in melanoma shared that the most exciting data to come out of ESMO was the ipi adjuvant data. He shared that he was thrilled to see the improvement in OS and that this would give him and his patients confidence to continue using it.
