text,source_type,date,title,text
"I met with a GU RTL the Monday morning after the publication of the New York Times article on IO therapy AEs.  The RTL brought up the article and stated that it was good that the article discussed real world patient immune mediated adverse events that occurred, so the community is aware of how serious the immune mediated adverse events can be with IO agents.  The RTL also thought it was good that the article talked about how these events can begin with very subtle symptoms and can happen any time while on treatment and even after being off treatment.  The RTL also commented that the article was 'a bit harsh' on IO therapy however, and 'hopes it does not scare' physicians from using IO therapies in appropriate patients, because the symptoms are 'manageable'.",Unknown,1481000400.0,,"I met with a GU RTL the Monday morning after the publication of the New York Times article on IO therapy AEs.  The RTL brought up the article and stated that it was good that the article discussed real world patient immune mediated adverse events that occurred, so the community is aware of how serious the immune mediated adverse events can be with IO agents.  The RTL also thought it was good that the article talked about how these events can begin with very subtle symptoms and can happen any time while on treatment and even after being off treatment.  The RTL also commented that the article was 'a bit harsh' on IO therapy however, and 'hopes it does not scare' physicians from using IO therapies in appropriate patients, because the symptoms are 'manageable'."
"Several local RCC TLs have stated that while PDL1 testing is a ""hot topic"" for lung, in RCC patients they do not find the need to test.",Unknown,1480914000.0,,"Several local RCC TLs have stated that while PDL1 testing is a ""hot topic"" for lung, in RCC patients they do not find the need to test."
Community TL commented that in 2L RCC he treats his patients with nivo but does not feel the need to test for PDL-1 as patients benefit regardless unlike patients treated in lung with PD1 agents.,Unknown,1478494800.0,,Community TL commented that in 2L RCC he treats his patients with nivo but does not feel the need to test for PDL-1 as patients benefit regardless unlike patients treated in lung with PD1 agents.
"Regional TL mentioned she gives her patients cabozatinib over nivolumab those with visceral disease because of limited data to support nivo use in these patients.  Shared ASCO 2016 subgroup data and QOL, TL stated she's switching her stance based on the data and favorable safety profile.",Unknown,1473480000.0,,"Regional TL mentioned she gives her patients cabozatinib over nivolumab those with visceral disease because of limited data to support nivo use in these patients.  Shared ASCO 2016 subgroup data and QOL, TL stated she's switching her stance based on the data and favorable safety profile."
RCC RTL stated he's treated a one patient in the 1L setting with regimen adopting the nivo 3 mg/kg and ipi 1 mg/kg dose and has seen positive responses.,Unknown,1472443200.0,,RCC RTL stated he's treated a one patient in the 1L setting with regimen adopting the nivo 3 mg/kg and ipi 1 mg/kg dose and has seen positive responses.
RCC RTL stated he's seen positive activity in two patients he's treated with nivo.,Unknown,1472443200.0,,RCC RTL stated he's seen positive activity in two patients he's treated with nivo.
RCC TL attended a program who stated that the speaker attempted to differentiate cabo with IO agents by calling out potential for unconventional responses and highlighting patients with bulky diseases having more of a favorable response if on cabo.,Unknown,1463112000.0,,RCC TL attended a program who stated that the speaker attempted to differentiate cabo with IO agents by calling out potential for unconventional responses and highlighting patients with bulky diseases having more of a favorable response if on cabo.
RTL feels that based on the durability of response seen with nivo and the low toxicities she would use this over cabozantinib for her RCC patients.,Unknown,1460433600.0,,RTL feels that based on the durability of response seen with nivo and the low toxicities she would use this over cabozantinib for her RCC patients.
TL stated that the significant mPFS data and positive OS result of cabozantinib over Everolimus does not outweigh the low toxicity seen with Opdivo and would continue to treat patients in the 2L with Opdivo.  He has heard from a source that there's an ongoing IST looking at cabozatinib + Opdivo in 1L RCC with Exelexis.,Unknown,1457326800.0,,TL stated that the significant mPFS data and positive OS result of cabozantinib over Everolimus does not outweigh the low toxicity seen with Opdivo and would continue to treat patients in the 2L with Opdivo.  He has heard from a source that there's an ongoing IST looking at cabozatinib + Opdivo in 1L RCC with Exelexis.
"RTL mentioned the importance of the positive QoL slide discussed by Hammers  and had echoed that TKIs are less tolerable than everolimus with respect to toxcitities.  For him, nivolumab is currently SOC in 2L setting for mRCC and feel that the OS data with cabozantinib will unlikely change his treatment based on significant toxicities observed in trial.",Unknown,1456722000.0,,"RTL mentioned the importance of the positive QoL slide discussed by Hammers  and had echoed that TKIs are less tolerable than everolimus with respect to toxcitities.  For him, nivolumab is currently SOC in 2L setting for mRCC and feel that the OS data with cabozantinib will unlikely change his treatment based on significant toxicities observed in trial."
"TL likes the fact that oral agents for RCC gets a fast response vs. slower response from Nivo.  However, the I/O provides durability.",Unknown,1470715200.0,,"TL likes the fact that oral agents for RCC gets a fast response vs. slower response from Nivo.  However, the I/O provides durability."
Local TL says that there is no need for PDL1 testing for RCC patients  but one of his colleagues who also treats lung cancer has started testing all of his oncology patients. He doesn't use it for treatment decisions but for expectations of if a patient will respond,Unknown,1479618000.0,,Local TL says that there is no need for PDL1 testing for RCC patients  but one of his colleagues who also treats lung cancer has started testing all of his oncology patients. He doesn't use it for treatment decisions but for expectations of if a patient will respond
"Local TL who only treats GU patients, says to date he has yet to use cabo for RCC. One of his colleagues who has used the drug for thyroid cancer has complained of the toxicity so he has no desire to use it",Unknown,1479618000.0,,"Local TL who only treats GU patients, says to date he has yet to use cabo for RCC. One of his colleagues who has used the drug for thyroid cancer has complained of the toxicity so he has no desire to use it"
"Regional TL and investigator does not do PDL1 testing for any patients. During the topic of PDL1 testing he asked ""why would anyone do PDL1 testing for RCC patients, didn't they see the -025 data. Even for bladder patients there is not enough substantiated data for me to not treat a second line bladder patient with an IO agent""",Unknown,1476331200.0,,"Regional TL and investigator does not do PDL1 testing for any patients. During the topic of PDL1 testing he asked ""why would anyone do PDL1 testing for RCC patients, didn't they see the -025 data. Even for bladder patients there is not enough substantiated data for me to not treat a second line bladder patient with an IO agent"""
"Regional TL and speaker says he doesn't do PDL1 testing at all. He currently treats RCC, bladder and H&N patients and doesn't believe for the current indications there is any reason to test. He is a believer in nivo. Recently had a patient who had failed nearly every TKI including cabo and has been on nivo for 5 cycles and has seen >50% reduction in his primary tumor. TL is blown away by the results.",Unknown,1476331200.0,,"Regional TL and speaker says he doesn't do PDL1 testing at all. He currently treats RCC, bladder and H&N patients and doesn't believe for the current indications there is any reason to test. He is a believer in nivo. Recently had a patient who had failed nearly every TKI including cabo and has been on nivo for 5 cycles and has seen >50% reduction in his primary tumor. TL is blown away by the results."
Regional TL and speaker mentions that the RCC landscape will change quickly. Is impressed with the lenvatinib + everolimus data and not scared of the toxicity. Believes that Inlyta will become extinct (also a speaker for Pfizer),Unknown,1461556800.0,,Regional TL and speaker mentions that the RCC landscape will change quickly. Is impressed with the lenvatinib + everolimus data and not scared of the toxicity. Believes that Inlyta will become extinct (also a speaker for Pfizer)
TL is very interested in research opportunities of combining Opdivo with Prostvac (now acquired by BMS),Unknown,1459310400.0,,TL is very interested in research opportunities of combining Opdivo with Prostvac (now acquired by BMS)
National TL and NCCN member expresses her satisfaction with nivo for RCC patients as it extremely well tolerated,Unknown,1459310400.0,,National TL and NCCN member expresses her satisfaction with nivo for RCC patients as it extremely well tolerated
"NTL performed biomarker analysis on samples from -025 study and found high levels of CD8+ T cells in the tumor correlated with better response to Nivo vs everolimus.  Also, found high levels of CD45RO, PDL1 associated with response.  TL started to formulate a treatment algorithm based on CD8 positivity.  CD8+ > 15% = Nivo, CD8+ between 5  14% = Nivo+Ipi, CD8+ < 5% = Novel strategies to recruit T cells into TME.",Unknown,1461902400.0,,"NTL performed biomarker analysis on samples from -025 study and found high levels of CD8+ T cells in the tumor correlated with better response to Nivo vs everolimus.  Also, found high levels of CD45RO, PDL1 associated with response.  TL started to formulate a treatment algorithm based on CD8 positivity.  CD8+ > 15% = Nivo, CD8+ between 5  14% = Nivo+Ipi, CD8+ < 5% = Novel strategies to recruit T cells into TME."
RTL stated he has promising preclinical data in RCC demonstrating a synergistic response with IDO + Nivo providing a rationale for further investigation.  Didn't state which IDO inhibitor.,Unknown,1466308800.0,,RTL stated he has promising preclinical data in RCC demonstrating a synergistic response with IDO + Nivo providing a rationale for further investigation.  Didn't state which IDO inhibitor.
"RTL mentioned they are participating in a trial with Nivo + avastin in RCC and have seen some remarkable results referring to pts experiencing the ""Lazarus Effect"".  TL stated BMS needs to investigate this combo in bladder cancer as well.  He said mechanistically the combination reshapes the tumor microenviroment making it more permissible to T cell infiltration and anti-tumor effect.",Unknown,1466049600.0,,"RTL mentioned they are participating in a trial with Nivo + avastin in RCC and have seen some remarkable results referring to pts experiencing the ""Lazarus Effect"".  TL stated BMS needs to investigate this combo in bladder cancer as well.  He said mechanistically the combination reshapes the tumor microenviroment making it more permissible to T cell infiltration and anti-tumor effect."
"RCC NTL mentioned the ""non-inflamed tumor phenotype"" (no immune cells in the TME) could be related to the vasculature surrounding the tumor.  TL has unpublished data demonstrating immune cells roll along the endothelium latching onto cellular adhesion molecules (CAMs) and once they encounter the appropriate chemokines from immune cells they extravasate toward the tumor.  The tumor secretes substances that effect the permeability of the endothelium making it leaky and filled with gaps. T cells can no longer adhere to the endothelium and extravasate toward tumor so they just float through the vessel away from the tumor.  This may help explain the reason why there are no immune cells within TME. He stated he has unpublished data showing that treatment with a certain VEGF inhibitor re-establishes the vasculature to more ""normal"" situation and the T cells are then able to receive the chemokine signals, adhere to endothelium, extravasate and enter TME.  He stated a combination of this particular VEGF inhibitor (didn't mention which one but said he'll let me know when published) and Nivo may lead to more T cell penetration of TME and better responses.  He stated we need to find ways to recruit T cells into this TME due to the lack of immune cells this setting.",Unknown,1457240400.0,,"RCC NTL mentioned the ""non-inflamed tumor phenotype"" (no immune cells in the TME) could be related to the vasculature surrounding the tumor.  TL has unpublished data demonstrating immune cells roll along the endothelium latching onto cellular adhesion molecules (CAMs) and once they encounter the appropriate chemokines from immune cells they extravasate toward the tumor.  The tumor secretes substances that effect the permeability of the endothelium making it leaky and filled with gaps. T cells can no longer adhere to the endothelium and extravasate toward tumor so they just float through the vessel away from the tumor.  This may help explain the reason why there are no immune cells within TME. He stated he has unpublished data showing that treatment with a certain VEGF inhibitor re-establishes the vasculature to more ""normal"" situation and the T cells are then able to receive the chemokine signals, adhere to endothelium, extravasate and enter TME.  He stated a combination of this particular VEGF inhibitor (didn't mention which one but said he'll let me know when published) and Nivo may lead to more T cell penetration of TME and better responses.  He stated we need to find ways to recruit T cells into this TME due to the lack of immune cells this setting."
"RCC NTL mentioned the differences in the tumor microenvironment (TME) that may influence response to Nivo.  
1)  ""Inflamed tumor phenotype""  Immune cells have penetrated the TME (Immune Cell Rich Zone) and a battle is taking place between immune and tumor cells leading to inflammation. We were discussing the MSKCC intermediate and poor risk subgroup analysis.  He said some intermediate and especially poor risk pts tend to be associated with the inflamed tumor phenotype, IFN-gamma production, high PDL1 expression, and are more responsive to Nivo.  
2) ""Non-inflamed tumor phenotype""  immune cells are not found within the TME (Immune Cell Free Zone).  He attributes this to the immunosuppressive nature of tumor cells suppressing chemokines/cytokines production that recruits the T cells into the microenvironment.  He said these pts tend to have less of a response to Nivo and novel strategies need to be employed to recruit T cells into the TME such as combinations with vaccines, anti-angiogenic agents, etc.",Unknown,1457240400.0,,"RCC NTL mentioned the differences in the tumor microenvironment (TME) that may influence response to Nivo.  
1)  ""Inflamed tumor phenotype""  Immune cells have penetrated the TME (Immune Cell Rich Zone) and a battle is taking place between immune and tumor cells leading to inflammation. We were discussing the MSKCC intermediate and poor risk subgroup analysis.  He said some intermediate and especially poor risk pts tend to be associated with the inflamed tumor phenotype, IFN-gamma production, high PDL1 expression, and are more responsive to Nivo.  
2) ""Non-inflamed tumor phenotype""  immune cells are not found within the TME (Immune Cell Free Zone).  He attributes this to the immunosuppressive nature of tumor cells suppressing chemokines/cytokines production that recruits the T cells into the microenvironment.  He said these pts tend to have less of a response to Nivo and novel strategies need to be employed to recruit T cells into the TME such as combinations with vaccines, anti-angiogenic agents, etc."
"RCC NTL stated BMS has focused significant resources and strategy on development of Ipi+Nivo in multiple tumor types including RCC.  Although TL expressed this is an excellent strategy, he mentioned that if efficacy is not much better or the toxicity is too bad, BMS could be in trouble and ultimately lose in RCC.  He stated we are not aggressively pursuing many other TKI combinations with Nivo compared to our competitors.  Stated we need to start this immediately.  TL specifically mentioned Nivo+Cabo combination front-line RCC.  He stated Merck, AZ, and Genentech are already in discussions to combine Cabo with their anti-PD1/PDL1 agents.",Unknown,1466308800.0,,"RCC NTL stated BMS has focused significant resources and strategy on development of Ipi+Nivo in multiple tumor types including RCC.  Although TL expressed this is an excellent strategy, he mentioned that if efficacy is not much better or the toxicity is too bad, BMS could be in trouble and ultimately lose in RCC.  He stated we are not aggressively pursuing many other TKI combinations with Nivo compared to our competitors.  Stated we need to start this immediately.  TL specifically mentioned Nivo+Cabo combination front-line RCC.  He stated Merck, AZ, and Genentech are already in discussions to combine Cabo with their anti-PD1/PDL1 agents."
RCC NTL stated the data from Checkmate 012 was amazing especially maintaining efficacy and reducing tolerability.  Would like to know if this dose/schedule will be investigated in RCC,Unknown,1467259200.0,,RCC NTL stated the data from Checkmate 012 was amazing especially maintaining efficacy and reducing tolerability.  Would like to know if this dose/schedule will be investigated in RCC
"RCC RTL stated the ""Regimen is toxic"" based on his experience treating pts on the -214 study.  He said BMS should focus on training ER physicians on identification and management of IMARs.  Often times if pt goes to ER for GI related tox the physician treats pt with Imodium which delays appropriate steroid intervention which could be very problematic. For community practices, BMS should also train the ""On-Call"" physicians as well as they sometimes may not be aware of the IMARs.  Any delays on appropriate intervention for toxicities associated with the Regimen can be a significant issue.",Unknown,1466049600.0,,"RCC RTL stated the ""Regimen is toxic"" based on his experience treating pts on the -214 study.  He said BMS should focus on training ER physicians on identification and management of IMARs.  Often times if pt goes to ER for GI related tox the physician treats pt with Imodium which delays appropriate steroid intervention which could be very problematic. For community practices, BMS should also train the ""On-Call"" physicians as well as they sometimes may not be aware of the IMARs.  Any delays on appropriate intervention for toxicities associated with the Regimen can be a significant issue."
An LTL in RCC shared that his practice used more pozopanib over sunitinib in the 1st line setting for RCC.  He believe pazopanib has much better toxicity profile.,Unknown,1456894800.0,,An LTL in RCC shared that his practice used more pozopanib over sunitinib in the 1st line setting for RCC.  He believe pazopanib has much better toxicity profile.
"A NTL shared with me that he attended Cabozantonib Ad board. One of the arguments Exelixis try to put forward was that cabo is the only compound that has both PFS and OS data, therefore why would you not use Cabo before Nivolumab? The TL shared that he along with many others MDs at the Ad board shared that Cabo is just flat out too toxic. TL shared an example of a pt that lost 25-30 lbs in month while on cabo. Even though that's pts bone disease improved, the pt is the one that want to come off of cabo after 1 month due to toxic (severe weight loss).",Unknown,1456462800.0,,"A NTL shared with me that he attended Cabozantonib Ad board. One of the arguments Exelixis try to put forward was that cabo is the only compound that has both PFS and OS data, therefore why would you not use Cabo before Nivolumab? The TL shared that he along with many others MDs at the Ad board shared that Cabo is just flat out too toxic. TL shared an example of a pt that lost 25-30 lbs in month while on cabo. Even though that's pts bone disease improved, the pt is the one that want to come off of cabo after 1 month due to toxic (severe weight loss)."
"A RTL from Vermont shared that her institution is testing all pts for PD-L1 status, including RCC pts.  However this is for research purposes and no clinical decision are being based on the results (other than 1st line NSCLC pts).",Unknown,1479445200.0,,"A RTL from Vermont shared that her institution is testing all pts for PD-L1 status, including RCC pts.  However this is for research purposes and no clinical decision are being based on the results (other than 1st line NSCLC pts)."
A RTL stated that he does not test PD-L1 for his RCC pts.,Unknown,1479445200.0,,A RTL stated that he does not test PD-L1 for his RCC pts.
"An RTL from New England shared with me that while they are testing all their 1st line NSCLC pts for PD-L1, they are not doing the same for any other tumor type (ie: RCC).",Unknown,1479013200.0,,"An RTL from New England shared with me that while they are testing all their 1st line NSCLC pts for PD-L1, they are not doing the same for any other tumor type (ie: RCC)."
A Regional TL shared that he is not testing any other tumor types (outside of Lung) for PD-L1 status.,Unknown,1478145600.0,,A Regional TL shared that he is not testing any other tumor types (outside of Lung) for PD-L1 status.
A LTL stated that no one in her practice test for PD-L1 for her RCC pts.,Unknown,1478145600.0,,A LTL stated that no one in her practice test for PD-L1 for her RCC pts.
"When asked about PD-L1 test, an RTL from the New England area informed me ""that they just started testing all of there NSCLC pts for PD-L1, but for RCC pts, there are not testing at all"".",Unknown,1476763200.0,,"When asked about PD-L1 test, an RTL from the New England area informed me ""that they just started testing all of there NSCLC pts for PD-L1, but for RCC pts, there are not testing at all""."
"An RTL shared that Nivolumab is his preferred 2nd line treatment for RCC since Cabo and/or Levantinib+Evero have too much toxicity...in general, indicating that toxicity profile is the number 1 factor in choosing 2nd line agent.  I asked if what if this was front line?  He responded that efficacy would be his 1st priority in choosing 1st line agent, and indicated that the other TKIs would good options.",Unknown,1466395200.0,,"An RTL shared that Nivolumab is his preferred 2nd line treatment for RCC since Cabo and/or Levantinib+Evero have too much toxicity...in general, indicating that toxicity profile is the number 1 factor in choosing 2nd line agent.  I asked if what if this was front line?  He responded that efficacy would be his 1st priority in choosing 1st line agent, and indicated that the other TKIs would good options."
"A NTL in Renal shared that cabozantinib data with PFS and OS looks compelling and upon approval, he would offer both nivolumab and cabozantinib equally to his pts. We discussed the AE profile of both products, but it did not seem to bother him.",Unknown,1458792000.0,,"A NTL in Renal shared that cabozantinib data with PFS and OS looks compelling and upon approval, he would offer both nivolumab and cabozantinib equally to his pts. We discussed the AE profile of both products, but it did not seem to bother him."
"An RTL stated that even though Cabozanthinib has ORR, PFS, & OS, it has ""tons"" of toxicity!  In the 2nd line setting, many pts want something that doesn't cause too much toxicity therefore nivolumab is far more attractive as a choice then Cabo.",Unknown,1457586000.0,,"An RTL stated that even though Cabozanthinib has ORR, PFS, & OS, it has ""tons"" of toxicity!  In the 2nd line setting, many pts want something that doesn't cause too much toxicity therefore nivolumab is far more attractive as a choice then Cabo."
A Local TL for RCC spoke very highly of BMS Access Support around gaining access to Nivolumab for a few of his bladder pts (2-3 pts).,Unknown,1457586000.0,,A Local TL for RCC spoke very highly of BMS Access Support around gaining access to Nivolumab for a few of his bladder pts (2-3 pts).
"During a brief conversation at a CME event, a national/regional RCC AI and NCCN panelist (bladder, prostate, and penile cancer) from the South HSL territory provided the following unsolicited insight: 
Has used nivo in 3 patients with non-clear cell RCC; 1 did extremely well. Some payers are reluctant to pay for such off-guideline treatments; other do not cause any problem. Would support the extension of nivo recommendation to non-clear cell RCC in NCCN guidelines and compendium.",Unknown,1472788800.0,,"During a brief conversation at a CME event, a national/regional RCC AI and NCCN panelist (bladder, prostate, and penile cancer) from the South HSL territory provided the following unsolicited insight: 
Has used nivo in 3 patients with non-clear cell RCC; 1 did extremely well. Some payers are reluctant to pay for such off-guideline treatments; other do not cause any problem. Would support the extension of nivo recommendation to non-clear cell RCC in NCCN guidelines and compendium."
