text,source_type,date,title,text
"RCC discussion around tolerability of agents.  MD stated that TKI are not benign drugs, patients experience a lot of fatigue, exhaustion, lack of energy.  He stated his Nivo patients seem to be rejuvenated!",Unknown,1472097600.0,,"RCC discussion around tolerability of agents.  MD stated that TKI are not benign drugs, patients experience a lot of fatigue, exhaustion, lack of energy.  He stated his Nivo patients seem to be rejuvenated!"
"TL at a VA site mentioned that he had bladder cancer patients he wanted to treat with Atezo - said it was not yet available at the VA.  Inquired as to when Nivo would be approved, referred him to area ARM for possible Nivo through access support.",Unknown,1468209600.0,,"TL at a VA site mentioned that he had bladder cancer patients he wanted to treat with Atezo - said it was not yet available at the VA.  Inquired as to when Nivo would be approved, referred him to area ARM for possible Nivo through access support."
"An HCP has been sending out RCC tumor samples to NeoGenomics to examine a panel of markers, including PD-L1, but this is not usually performed up front. Despite testing, he does not use this data to determine use of Opdivo. He uses Opdivo 2L for the majority of his patients.",Unknown,1478232000.0,,"An HCP has been sending out RCC tumor samples to NeoGenomics to examine a panel of markers, including PD-L1, but this is not usually performed up front. Despite testing, he does not use this data to determine use of Opdivo. He uses Opdivo 2L for the majority of his patients."
"A regional TL stated that while he believes PD-L1 expression may impact responses in renal and bladder patients, he does not test for PD-L1 in these tumor types because he also thinks the negative patients can benefit.",Unknown,1477627200.0,,"A regional TL stated that while he believes PD-L1 expression may impact responses in renal and bladder patients, he does not test for PD-L1 in these tumor types because he also thinks the negative patients can benefit."
A regional TL does not use Cabozantinib in his RCC patients because it is not well-tolerated. He prefers Nivolumab in the 2L because the disease control rate is very high.,Unknown,1477627200.0,,A regional TL does not use Cabozantinib in his RCC patients because it is not well-tolerated. He prefers Nivolumab in the 2L because the disease control rate is very high.
"NTL in GU shared that IO may have some activity in prostrate. He shared that his colleagues have shown about a 20% RR with single agent pembro as well as in combination with ""the vaccine"". He shared that the best way to administer the combination was concurrently rather than sequentially.",Unknown,1481605200.0,,"NTL in GU shared that IO may have some activity in prostrate. He shared that his colleagues have shown about a 20% RR with single agent pembro as well as in combination with ""the vaccine"". He shared that the best way to administer the combination was concurrently rather than sequentially."
"NTL in GU shared that cabozantinib is less toxic than he originally thought. He starts patients on the full dose but then dose reduces after the first or second dose. He shared that he even found dose reducing to 20 mg was efficacious for some patients. Despite the reductions, there were still some patients who cannot tolerate it at any dose. 
He also shared that in the CaboSun trial, it is clear that sunitinib underperformed and that follow up data is needed. He further shared that he is certain that  that they will get FDA approval soon.",Unknown,1481605200.0,,"NTL in GU shared that cabozantinib is less toxic than he originally thought. He starts patients on the full dose but then dose reduces after the first or second dose. He shared that he even found dose reducing to 20 mg was efficacious for some patients. Despite the reductions, there were still some patients who cannot tolerate it at any dose. 
He also shared that in the CaboSun trial, it is clear that sunitinib underperformed and that follow up data is needed. He further shared that he is certain that  that they will get FDA approval soon."
"Community LTL of a large practice shared that they are routinely using Foundation One with each patient to provide a personalized medicine approach. Even though PD-L1 testing is available, they do not use the results for treatment decisions and would never consider it relevant for RCC.",Unknown,1478926800.0,,"Community LTL of a large practice shared that they are routinely using Foundation One with each patient to provide a personalized medicine approach. Even though PD-L1 testing is available, they do not use the results for treatment decisions and would never consider it relevant for RCC."
"NTL in GU shared that there is no sufficient study to answer which is the better option for treatment in the 2L. He stated that PFS is not a good marker of benefit in IO, and that he looks to the tail end of the OS curves. He feels that presently the data is not strong because of the small number of patients but that there is an indication that Nivolumab will have longer-term benefit with a favorable safety profile. He shared that he has looked to the consistency in the data across tumor types",Unknown,1478926800.0,,"NTL in GU shared that there is no sufficient study to answer which is the better option for treatment in the 2L. He stated that PFS is not a good marker of benefit in IO, and that he looks to the tail end of the OS curves. He feels that presently the data is not strong because of the small number of patients but that there is an indication that Nivolumab will have longer-term benefit with a favorable safety profile. He shared that he has looked to the consistency in the data across tumor types"
National TL in RCC shared that there is not sufficient evidence for how to choose between cabo and nivo for 2L RCC treatment but that some evidence points to the tail end of the curve for Nivolumab. He wants to see long-term OS for the 025 but for now is using the data that is available. He also shared that he does not test for PD-L1 based on the OS benefit for all patients.,Unknown,1478494800.0,,National TL in RCC shared that there is not sufficient evidence for how to choose between cabo and nivo for 2L RCC treatment but that some evidence points to the tail end of the curve for Nivolumab. He wants to see long-term OS for the 025 but for now is using the data that is available. He also shared that he does not test for PD-L1 based on the OS benefit for all patients.
Two community LTLs shared that they are not testing for PD-L1 in the RCC setting. They do not see the need based on the RCC data but they will begin testing in lung. One stated that he does not have a lot of experience with the various diagnostic tests and hopes to find one that he can interpret easily and that he can trust.,Unknown,1477713600.0,,Two community LTLs shared that they are not testing for PD-L1 in the RCC setting. They do not see the need based on the RCC data but they will begin testing in lung. One stated that he does not have a lot of experience with the various diagnostic tests and hopes to find one that he can interpret easily and that he can trust.
NTL in GU shared that with atezo there is a high rate of low grade infections that is not seen with other antibodies and that more data sets will show this.,Unknown,1477281600.0,,NTL in GU shared that with atezo there is a high rate of low grade infections that is not seen with other antibodies and that more data sets will show this.
"RTL in renal who is also on speakers bureau shared that at her programs, she has only been asked about 3 times what the data is for PD-L1 expression in the 025 trial. She shared that she has spoken to a lot of HCPs in the community and has not heard of anyone testing or wanting to test.",Unknown,1476676800.0,,"RTL in renal who is also on speakers bureau shared that at her programs, she has only been asked about 3 times what the data is for PD-L1 expression in the 025 trial. She shared that she has spoken to a lot of HCPs in the community and has not heard of anyone testing or wanting to test."
Community TL questioned the 067 data and wanted to use PD-L1 testing in melanoma to determine use of monotherapy or regimen. He shared that he has decided not to do this based on attending a local conference and hearing the opinion of a NTL and that it makes sense to not test. He further shared that he does not test for PD-L1 in RCC but could not recall the data (which I was able to share and refresh his memory after he requested to see it).,Unknown,1476676800.0,,Community TL questioned the 067 data and wanted to use PD-L1 testing in melanoma to determine use of monotherapy or regimen. He shared that he has decided not to do this based on attending a local conference and hearing the opinion of a NTL and that it makes sense to not test. He further shared that he does not test for PD-L1 in RCC but could not recall the data (which I was able to share and refresh his memory after he requested to see it).
"Community LTL pharmacist shared that he was impressed by the QoL data in RCC and shared that the levantinib reps had stated that their data was ""better"". He further shared that he thought that levantinib and everolimus toxicities were difficult to deal with.",Unknown,1473912000.0,,"Community LTL pharmacist shared that he was impressed by the QoL data in RCC and shared that the levantinib reps had stated that their data was ""better"". He further shared that he thought that levantinib and everolimus toxicities were difficult to deal with."
Community LTL shared that he really didn't understand pseudo-progression because he felt that there were conflicting reports in the field. He would like a data review of the tumor types and different agents used to completely understand.,Unknown,1471147200.0,,Community LTL shared that he really didn't understand pseudo-progression because he felt that there were conflicting reports in the field. He would like a data review of the tumor types and different agents used to completely understand.
"An academic RTL shared that his institution participated in both the Meteor trial and CM032 and that he feels that there are now two good choices for second line RCC. He shared that while it is difficult to choose between the two, he prefers the toxicity profile for nivo. He also shared that he is very interested in seeing longer term follow up for both compounds.",Unknown,1469592000.0,,"An academic RTL shared that his institution participated in both the Meteor trial and CM032 and that he feels that there are now two good choices for second line RCC. He shared that while it is difficult to choose between the two, he prefers the toxicity profile for nivo. He also shared that he is very interested in seeing longer term follow up for both compounds."
Regional community TL shared that there was a recent JCO publication on patients who had undergone a nephrectomy had better outcomes with targeted therapy that patients who had not. He shared that he thought that there was a data gap with IO agents but suspected that it would hold up and that nephrectomy would improve outcomes.,Unknown,1469592000.0,,Regional community TL shared that there was a recent JCO publication on patients who had undergone a nephrectomy had better outcomes with targeted therapy that patients who had not. He shared that he thought that there was a data gap with IO agents but suspected that it would hold up and that nephrectomy would improve outcomes.
Sales rep from Pfizer shared that the sutent reps are in a panic over our approval and are very worried about their place in the treatment paradigm.,Unknown,1462334400.0,,Sales rep from Pfizer shared that the sutent reps are in a panic over our approval and are very worried about their place in the treatment paradigm.
Academic RTL shared that they are only using Nivolumab for 2L RCC and that the approval has even changed their way of thinking about clinical trials. They will only consider RCC trials in which an agent is investigated as 3L or later since they know that they want to use nivo in the second line.,Unknown,1462334400.0,,Academic RTL shared that they are only using Nivolumab for 2L RCC and that the approval has even changed their way of thinking about clinical trials. They will only consider RCC trials in which an agent is investigated as 3L or later since they know that they want to use nivo in the second line.
"National TL in renal shared that with nivo and cabozantinib, it is a head to head competition over which one he will use. Both agents look good and it is not presently clear which one looks better.",Unknown,1462334400.0,,"National TL in renal shared that with nivo and cabozantinib, it is a head to head competition over which one he will use. Both agents look good and it is not presently clear which one looks better."
"Regional TL shared that he has 3 RCC patients on Nivolumab all for at least 10 weeks but that none of them has had a response yet. He shared that their disease looks stable and as long as they are asymptomatic, he is comfortable continuing to treat and drawing from his experiences in IO with melanoma patients.",Unknown,1459137600.0,,"Regional TL shared that he has 3 RCC patients on Nivolumab all for at least 10 weeks but that none of them has had a response yet. He shared that their disease looks stable and as long as they are asymptomatic, he is comfortable continuing to treat and drawing from his experiences in IO with melanoma patients."
A regional TL shared that the median OS in RCC was difficult to interpret and that 1 year survival statistics in general paint a clearer picture of the efficacy of the drug.,Unknown,1459137600.0,,A regional TL shared that the median OS in RCC was difficult to interpret and that 1 year survival statistics in general paint a clearer picture of the efficacy of the drug.
"During a presentation at a conference, a Pfizer industry representative reviewed the use of avelumab in combination with axitinib in RCC and stated that the rationale for looking at this combination was that Keytruda and axitinib for RCC looked promising indicating that they are basing some development decisions on what competitors are doing.",Unknown,1456894800.0,,"During a presentation at a conference, a Pfizer industry representative reviewed the use of avelumab in combination with axitinib in RCC and stated that the rationale for looking at this combination was that Keytruda and axitinib for RCC looked promising indicating that they are basing some development decisions on what competitors are doing."
"NCCN Advisor for RCC shared he is leaving his current academic institution to a new position where he will be the director of research at the 2nd established Kidney Cancer Spore (the other is at Dana farber Harvard Cancer Institute). here his focus will be almost completely on research with IO and combinations with IO, as well as imaging techniques that will assist in better understanding responses and patterns of responses to these agents. He hopes to continue his collaboration with BMS as he believes they are the leader in IO.",Unknown,1459137600.0,,"NCCN Advisor for RCC shared he is leaving his current academic institution to a new position where he will be the director of research at the 2nd established Kidney Cancer Spore (the other is at Dana farber Harvard Cancer Institute). here his focus will be almost completely on research with IO and combinations with IO, as well as imaging techniques that will assist in better understanding responses and patterns of responses to these agents. He hopes to continue his collaboration with BMS as he believes they are the leader in IO."
An academic GU TL does not use cabozantinib or lenvatinib/everolimus combo in 2L mRCC. This TL prefers Nivolumab because of its efficacy and safety profile.,Unknown,1479790800.0,,An academic GU TL does not use cabozantinib or lenvatinib/everolimus combo in 2L mRCC. This TL prefers Nivolumab because of its efficacy and safety profile.
"An academic TL prefers Nivolumab in 2L for mRCC. However, in patients presenting with bulky disease at the time of diagnosis, the TL prefers Lenvatinib plus Everolimus.",Unknown,1476244800.0,,"An academic TL prefers Nivolumab in 2L for mRCC. However, in patients presenting with bulky disease at the time of diagnosis, the TL prefers Lenvatinib plus Everolimus."
"A local RCC TL, who is also one of our contracted speakers, shared he does not use PD-L1 testing for his RCC patient population.  He further added that he has received the question on whether to use PD-L1 testing in RCC by the audience at our promotional programs. His said his response is no based on our Checkmate OS data.",Unknown,1475208000.0,,"A local RCC TL, who is also one of our contracted speakers, shared he does not use PD-L1 testing for his RCC patient population.  He further added that he has received the question on whether to use PD-L1 testing in RCC by the audience at our promotional programs. His said his response is no based on our Checkmate OS data."
"A community oncologist prefers Nivolumab in 2L mRCC over cabozantinib because of their distinct MOA. The TL stated "" it makes more sense to use a drug with a different mechanism of action in patients who have failed TKI therapy in 1L than using another TKI"".",Unknown,1474603200.0,,"A community oncologist prefers Nivolumab in 2L mRCC over cabozantinib because of their distinct MOA. The TL stated "" it makes more sense to use a drug with a different mechanism of action in patients who have failed TKI therapy in 1L than using another TKI""."
A national RCC TL stated RECIST criteria are not useful when evaluating clinical responses to I-O therapy and should not be used in I-O clinical trials. The TL does not use RECIST criteria when assessing clinical response to Opdivo in his RCC patients and treats patients beyond RECIST-defined progression.,Unknown,1474603200.0,,A national RCC TL stated RECIST criteria are not useful when evaluating clinical responses to I-O therapy and should not be used in I-O clinical trials. The TL does not use RECIST criteria when assessing clinical response to Opdivo in his RCC patients and treats patients beyond RECIST-defined progression.
A community oncologist shared he uses Nivolumab in 2L for patients with mccRCC. He shared that he recently started a patient with metastatic non-clear cell RCC (papillary histology) on Temsirolimus. Took the opportunity to inform the TL of the 209-374 study and the study site in Indiana.,Unknown,1471579200.0,,A community oncologist shared he uses Nivolumab in 2L for patients with mccRCC. He shared that he recently started a patient with metastatic non-clear cell RCC (papillary histology) on Temsirolimus. Took the opportunity to inform the TL of the 209-374 study and the study site in Indiana.
"A community oncologist shared his preference for the use of Opdivo in 2L for RCC versus Cabozantinib. He stated: I rather use a drug with a different MOA than another TKI in 2L RCC. He further commented: It would make more sense to use Cabozantinib in 1L. When addressing the safety profile of Opdivo he stated he is comfortable managing Opdivo AEs given that he treats NSCLC patients with Opdivo, therefore he knows what to watch for and how to manage them.",Unknown,1469592000.0,,"A community oncologist shared his preference for the use of Opdivo in 2L for RCC versus Cabozantinib. He stated: I rather use a drug with a different MOA than another TKI in 2L RCC. He further commented: It would make more sense to use Cabozantinib in 1L. When addressing the safety profile of Opdivo he stated he is comfortable managing Opdivo AEs given that he treats NSCLC patients with Opdivo, therefore he knows what to watch for and how to manage them."
"A national melanoma and RCC TL during our meeting asked if we have data on Nivolumab given Q3W. Following a review/discussion of the OS data from Checkmate -010, the TL made the following comments: 
a). The study did not include a treatment group with Nivolumab at 3 mg/kg. 
 b). We should compare Nivolumab 3 mg/kg Q2W vs Nivolumab 3mg/kg Q3W in randomized fashion.
 c). Our competitor has done a phase-3 study comparing pembrolizumab Q2W vs Q3W, while we have not.",Unknown,1469160000.0,,"A national melanoma and RCC TL during our meeting asked if we have data on Nivolumab given Q3W. Following a review/discussion of the OS data from Checkmate -010, the TL made the following comments: 
a). The study did not include a treatment group with Nivolumab at 3 mg/kg. 
 b). We should compare Nivolumab 3 mg/kg Q2W vs Nivolumab 3mg/kg Q3W in randomized fashion.
 c). Our competitor has done a phase-3 study comparing pembrolizumab Q2W vs Q3W, while we have not."
A local RCC TL commented to prefer Opdivo over Cabozantinib for 2L treatment of patients with mRCC.,Unknown,1462766400.0,,A local RCC TL commented to prefer Opdivo over Cabozantinib for 2L treatment of patients with mRCC.
"A RCC TL stated ""if a patient with mRCC has a good response to a TKI in 1L setting, then I would consider Cabozantinib upon progression"".",Unknown,1462766400.0,,"A RCC TL stated ""if a patient with mRCC has a good response to a TKI in 1L setting, then I would consider Cabozantinib upon progression""."
"A community oncologist mentioned the Lenvatinib study in mRCC and commented"" I do not remember the efficacy data but I seem to remember that Lenvatinib was too toxic""",Unknown,1461297600.0,,"A community oncologist mentioned the Lenvatinib study in mRCC and commented"" I do not remember the efficacy data but I seem to remember that Lenvatinib was too toxic"""
"A RCC NTL stated that he does not use RECIST criteria to evaluate clinical response to Opdivo in his mRCC patient population. In the opinion of this TL, RECIST criteria are not useful when evaluating clinical response to immunotherapies and should not be used even in the context of clinical trials when assessing clinical response to immunotherapy.",Unknown,1456117200.0,,"A RCC NTL stated that he does not use RECIST criteria to evaluate clinical response to Opdivo in his mRCC patient population. In the opinion of this TL, RECIST criteria are not useful when evaluating clinical response to immunotherapies and should not be used even in the context of clinical trials when assessing clinical response to immunotherapy."
A community oncologist is using Opdivo in a patient with stage III RCC with the goal of decreasing tumor burden prior to surgery. This information was provided following a reactive interaction with the oncologist who had reached out to discuss the management of increased LFTs in this patients. Please note that this increase in LFTs has been reported as an AE via 1-866-AE CALLS per SOP,Unknown,1456117200.0,,A community oncologist is using Opdivo in a patient with stage III RCC with the goal of decreasing tumor burden prior to surgery. This information was provided following a reactive interaction with the oncologist who had reached out to discuss the management of increased LFTs in this patients. Please note that this increase in LFTs has been reported as an AE via 1-866-AE CALLS per SOP
A community TL shared that he had a patient with mRCC who progressed on Opdivo. The TL had the patient tumor profiled via Foundation One. The tumor carried a somatic mTOR mutation. The patient is now being treated with Lenvatinib in combination with Everolimus. The oncologist shared the patient is responding to treatment and had no treatment-related AEs so far.,Unknown,1481086800.0,,A community TL shared that he had a patient with mRCC who progressed on Opdivo. The TL had the patient tumor profiled via Foundation One. The tumor carried a somatic mTOR mutation. The patient is now being treated with Lenvatinib in combination with Everolimus. The oncologist shared the patient is responding to treatment and had no treatment-related AEs so far.
"A Regional TL has several RCC patients on TKIs.  He considers that the response to subsequent TKI is suboptimal, therefore he knows that Opdivo will be his choice at progression.",Unknown,1476763200.0,,"A Regional TL has several RCC patients on TKIs.  He considers that the response to subsequent TKI is suboptimal, therefore he knows that Opdivo will be his choice at progression."
A RTL commented how one of her patients with RCC on Inlyta is having mild signs of progression and is waiting to go on Opdivo.  Patient learned about it from his Urologist.,Unknown,1467777600.0,,A RTL commented how one of her patients with RCC on Inlyta is having mild signs of progression and is waiting to go on Opdivo.  Patient learned about it from his Urologist.
