driver,type,subset,impact,score,related_terms,doc_count,example_doc,example_doc2,example_doc3
added,auto_found,Month,1.141777953757732,0.07364496337311807,['added'],148,"RTL from a major academic institution mentioned that currently there is no in-house PD-L1 test.  However, due to the results from KEYNOTE-024, the institution will be adding the 22C3 PD-L1 test to be done in-house by Q1 2017.  This is to expedite the eligibility criteria of pembrolizumab for the PD-L1 test to be 50% or higher.","During a proactive meeting to discuss CM-026 data, a member of the NCCN Board of Directors and Executive Director of a large regional cancer center made the following comments:
+++CM-227+++
?	Indicated that CM-227 might be BMS last chance in lung.
*       Since enrollment is nearly complete would not change anything (e.g., adding a new cohort would not be scientifically sound). 
*       Concerned about cohorts with PDL1 <1% (concerns only partially alleviated by review of CM-012 latest results).","A RTL from a Major Hospital in Boston shared at grand rounds that they do not perform PD-L1 testing for their NSCLC pts (beside if required by clinical trials).  He added that now that Keynote-024 is positive, they will have to test PD-L1 in all their 1st line NSCLC pts.  He did not specific which PD-L1 test his institution will be using."
standard,auto_found,Month,1.2406568451440265,0.07363181761455828,"['1L', 'preferred', 'not do PDL1 testing', '2L NSCLC', 'standard', '2L', 'second line']",834,"During a lung cancer symposium in the southeast region, Joseph Ritchie and I gathered the following unsolicited opinions from a NTL/ NCCN adviser (medical oncologist) who recently gave the position to a junior RadOnc faculty member/ Thoracic Oncology chair at an NCI-designated cancer center in the southeast region
-CM-026: results were unfortunate
-Pembro will be used at his institution for PD-L1 expressors >50%; however, only relevant for ~ 1 year until CM-227 reads out, and believes that if CM-227 approaches the results of CM-012, then Nivo+Ipi will be Standard of Care (SoC) in 1L
-Nivo will likely remain SoC for PD-L1 negative in 2L, (although believes that Nivo will lose some share of 2L PD-L1 positives, especially with introduction of Atezo because of more convenient dosing schedule with (perceived) comparable efficacy).","An HCP shared that MSI testing for all CRC specimens is routinely done in Puerto Rico, part of a standard panel.",TL has maintained Nivo as standard of care in 2L lung. No mention of Atezo and feels no need to change practice based on recent data except doing more up front PDL1 testing in lung.
treated,auto_found,Month,0.7206029739675615,0.0727865993189281,"['off-label', 'using nivolumab', 'RCC patients', 'treated', 'sarcoma', 'ipilimumab', 'disease']",710,"A Lung NTL told me that his site, which had not previously been requesting PD-L1 testing will be putting their own testing system in place soon and that they will soon be making decisions based on test results.  They intend to only use Pembro at the >50% PD-L1 expression but sicne the test results will be available for the patients treated with a platinum doublet, he expect Pembro will begin to gain a larger share of the business next year.  The tL also added that based on his site's experience with the Nivo+Ipi combo, they expect that single drug PD-1 therapy in the first line will ""Cease to exist in about a year""","Community oncologist shared that they have difficulties enrolling onto first line lung trials because it takes too long to wait for the results of the biopsy. Most of the medical oncologists will start treating a patient before the results of the biopsy have returned. Additionally, if a patient has had surgery, the hospital is responsible for ordering and charging for all testing on the biopsy sample for 30 days post surgery. They often either do not know to order tests or do not want to pay which introduces even further delays.","NP at academic institution says that they have started doing PDL1 testing and using pembro for interest sake. so few patients are ever PDL1>50% therefore they treat those patients with pembro to gather experience with the drug. Although their institution has pathologist, they are not doing the test in house and are sending it out. It comes back with a % but not sure how the test matches with pembro's companion diagnostic and nivo's companion diagnostic"
referral,auto_found,Month,1.506716694750976,0.07126193476862293,['referral'],11,Insights from TL from large healthcare network NW territory: i) molecular pathologists in the group have carefully assessed available testing methodologies and have as a result established their referral testing practices; ii) 3-5 cases per week are sent out for PD-L1 testing; iii) all PD-L1 tests are sent out to PhenoPath; iv) pembro is not considered for all NSCLC patients and as a result reflex testing for PD-L1 is not performed.,"At an international GI conference, a NTL in pancreatic cancer was asked by the audience if she performs genetic testing for germline mutations routinely.  She said for a non-trial pt, she does mutational analysis by the ?conventional route? - referral to clinical genomics facility on site.  This has the potential difficulty of pushback from insurance companies. Alternatively, she tries to get them onto an open trial that has genomic testing included in their entry requirements.  Example:  Olaparib trial allows expedited testing for BRCA testing if they are enrolled.  She also has funding to sample at recurrence to obtain a second profile as long as consent is granted.","Myself and Francis Lobo, HEOR met  with Michael Lessard, Pharmacy Director at Dartmouth Hitchcock and we had a  discussion around our Oncology portfolio and no real concerns regarding NSCLC and Opdivo.  Customer continues to cover Opdivo to label and have no plans on changing that. We reinforced our strong clinical profile in our approved indications and they believe in our data. Although they did request that we give discount for orphan drug for all classes of 340 b accounts. Currently we give discount for DSH account but not Rural Referral Center which they are."
hospice,auto_found,Month,1.2482026395932155,0.0691516804909655,"['hospice', 'surgery']",29,"The following unsolicited insights were provided by speakers from the podium at a recent oncology conference attended by national AI?s/TL?s in various tumor types and hematological malignancies.  

Breast 
?	While there is limited data, panel believed for metastatic triple negative breast immunotherapy is a high viable option
?	Sited studies currently ongoing with Merck and Roche in the neoadjuvant setting using IO with taxane.

Developmental Therapeutics
?	One panelist made a comment to the audience about VALUE of care; the importance of consideration of value in oncology care.  
o	For example, the importance of consideration of the idea of limiting lines of therapy before patient goes to hospice.  Also, he mentioned some pathways are thinking of limiting to 2 lines before hospice.

Hematological malignancies Board
?	Panelist said RVD is strong 1st line therapy, based upon the SWOG trial presented at ASH 2015, because of OS with RVD.  He says he believes KRD may be treatment of future, even though KRD not indicated for 1L currently.
?	Panelist says there is trial of RD v. KRD which may show whether it is a good 1st line treatment.

Lung 
Testing
?	Consensus with the lung panel that ordering broad molecular testing should always be an option and should be standard of care however the known issue is limitation of tissue
?	Concerns around timing of results from NGS may delay treatment for patients, ~3 weeks is too long especially when 15% of these patients waiting never receive treatment
?	Consensus that liquid biopsy is an exploratory option now as concerns around false negative rates but should be explored in the setting of a clinical trial and in cases where tissue is not available
?	Huge focus on targeted therapy during the meeting given that the chair is a huge believer of testing in all lines.  
?	A case was presented focusing on the following scenario:  For second line treatment of a patient with NSCLC?squamous histology, Zubrod PS 1:
o	70% of the audience selected, Nivolumab without sending for PD?L1 testing.
o	10% of the audience selected, Nivolumab only if PD?L1 testing is positive (>1%)
o	18% of the audience selected, Pembrolizumab if PD?L1 positive (>1%)
?	TL chairing the meeting stated that PD1 data in a ?chaotic state?
?	Panel members expressed that PD-L1 may not be the best marker in dealing with tumor heterogeneity in lung
?	One panel member said If he happens to have PDL1 info already and if it?s positive and more than 1%, then he might use pembro, given more patient friendly Q3w schedule.  If PDL1 info is not available, then he goes straight to Nivo without PDL1 testing and would argue that Q2w dosing is not that bad.  
?	A few RTLs mentioned that in the setting of >1% PD-L1 expression they would give pembrolizumab for patients needing the Q3W dosing schedule and would do the same in adeno histology in the 2L setting.
?	Panel discussed managing immune-mediated AEs from PD1 agents are often responsive to immunosuppression.  
?	One panelist said data for SQ and NSQ very different.  The case being discussed was a SQ patient.  He mentioned that IASCLC is doing studies around PDL1 testing.  He says he would change treatment approach of going straight to nivo if this was a NSQ patient (didn?t elaborate more).
?	Lung panelist mentioned to the audience about the availability of the ASCO/MSKCC DrugAbacus tool (assesses the value of drugs compared to pricing given consideration of factors such as cost, toxicity, and efficacy). He mentioned the idea that If you can?t show that a drug is better, it supports considering restrictions.


Melanoma
Adjuvant
?	Panel presented a case where patient was given adjuvant ipilimumab as part of the EORTC trial and after 2 cycles of 10 mg/kg dose patient developed severe GI perforations.  Issues raised were 1) why the 10 mg/kg dose was even chosen 2) significant cost but was later amended to the dose being supported through BMS APP 3) significant toxicities leading to discontinuation
?	Panel discussed while the incidence low, case of myocarditis and it is a significant concern to monitor for 
?	One RTL said the toxicities of ipilimumab at 10 mg/kg are quite sobering comparing it to IL2

Testing	
?	One RTL mentioned he is not testing outside of clinical trials, and is not done routinely as data is still revolving
?	Discussion on which types of patients would tolerate regimen best and consensus on those who are healthy and with good performance status
?	Some community oncologist are using PD-1 inhibitors off label for cutaneous SCC as they?ve seen positive responses to PD1-inhibitors and have not been turned down by insurance companies, often challenging for some patients to participate in a clinical trial program because of location
?	RTL mentioned that we are in a unique space where knowledge of drug is going to move faster than a FDA approval 
?	TL panel member mentioned his experience has been that grade of immune-mediated AE likely correlated to depth of response
?	Consensus that the direction moving forward would be combination checkpoint inhibitor with targeted strategy.  Interesting how ?one major company going for targeted approach and another company doing immune checkpoint combination.?",NTL in Boston mentioned that he has a meningioma patient who progressed after SOC treatment. At that time the patient was started on Nivo and was given 2 dose. The patient was progressing while on Nivo so it was decided to stop Nivo treatment. Two weeks after the 2nd dose the patient's neurosurgeon agreed to one more surgery as a last resort before hospice. The NTL mentioned that the surgeon removed necrotic tissue during surgery and the tumor is much improved. The patient remains with some cognitive deficit but doing better and not on hospice.,"Largest Community Practice in state: Regional TL Opdivo H&N and Elo Speaker: 
Pt w HCC on off label bms provided Opdivo and pt is 1yr out in response. He was about to go to hospice. Stated he was excited for pt as he just bought a car. No tox issues. He was previously on sorafinib and adria w tox issues."
push,auto_found,Month,1.657896957835638,0.06800279268954358,['push'],26,"NTL in midwest stated at her institution they generally push trials, especially after first line.  That said she stated in second line they almost always use Nivo over pembro.  She felt even though Roche had some ""iffy"" data in PDL-1 neg she felt it was minor and still thought her institution would use Nivo second line.  They have just started using pembro in first line in greater than 50% stainers.  They send out tissue (turnaround 10-14 days) but are working on getting test in house","When discussing -026 many TLs understand the reasoning behind including a broad patient population. However, there is push back regarding the imbalances in the trial regarding PDL1 status, with many not understanding how PDL1 status at various levels was so imbalanced and not taken into account during the planning of the trial. These TLs are not surprised by the result and simply state ""you need to redo the trial and design it right.""","Pan Tumor community research TL:

Surprised at and impressed by how big the magnitude of benefit was in KN024.  Acknowledges that it is going to fit for a very small portion of patients (he estimated 20% for his practice based on his own synthesis of PDL1 prevalence reported and PS/brain mets/etc in his own patients), however think that it is worth testing everyone at diagnosis and would try to treat anyone with >50% PDL1 with pembro 1L.  He is completely perplexed by the CM026 >50% negative data.  Thinks that this is likely ?a fluke?, but given the magnitude of benefit in 024 doesn?t think that small difference in patient populations could make data from ?super positive? to ?solidly negative? between trials so ?could be a real difference?. 

Note that prior to ESMO data, TL had low expectations overall for KN024 data, thinking magnitude would likely be reasonably small and that he would not likely make a huge push to PDL1 test everyone at 1L, so this is a marked shift in his attitude after seeing data.  He was, and remains, strongly pro-nivo regardless of PDL1 expression, for 2L - views haven?t changed."
frustration,auto_found,Month,1.9076202373690836,0.06450075650696635,['frustration'],12,"Community TL expressed frustration that insurance companies that he works with (private practice) don't use standardized  guidelines for making payment decisions. He cited how they switch between NCCN, Medicare, etc. to choose whatever is ""to their advantage"" as far as avoiding payment liability. He said this is particularly a problem in patients requiring genetic testing.","Very little pembro and PDL1 testing uptake in NSCLC across both community and academic TLs, leading to frustration and not wanting to test in furture. Few that have tried to test had long turn-around and almost no patients coming back positive leading to . Physicians in general state do not know which specific IHC test they are getting or the differences in cutoffs, etc.","Met with a national/regional lung AI, who provided the following unsolicited insights:
?	AI reactively mentioned that his institution is currently sending to 3rd party labs to conduct both the BMS and Merck PDL1 assays, due to inability of their in-house lab/pathology to support this testing in-house.  
?	AI expressed frustration that the one test they can perform in-house is the Ventana (Atezo) assay, for which they recently bought a machine.  We reviewed the FDA blueprint analysis that showed the Ventana assay as highly discordant with BMS/Merck assays and how this could lead to misclassification of some PDL1 expressers as non-expressers due to lack of sensitivity, which he admitted to understanding."
setting,auto_found,Month,1.0034574377525465,0.06391503320631162,"['preferred', 'second line', 'setting']",455,"NTL from NCCN institution remarked that in his opinion, within appox 4-12 months the front line setting would look like PDL-1 over 50% will be pembro OR nivo.  Under 50% will still be doublet, but that could/would change with more time","During a lung cancer symposium in the southeast region, Joseph Ritchie and I gathered the following unsolicited opinions from a NTL/ NCCN panelist (medical oncologist) at an NCI-designated cancer center in NYC
-Believes that the term ?value? is currently more of a talking point than something actionable. However, in light of -024 and -026, he sees ?value? as defining a population and not just giving expensive drugs to every patient that walks through the door.
-Also believes ORR is crucial and may even be the most important of endpoints to any conversation around value
-PD-L1 testing is as big a change as there has been in a long time when it comes to directing decision-making in oncology. If pathologists aren?t testing regularly for PD-L1, it is the duty of the medical oncologists to speak with their pathologists to better educate them (because pathologists aren?t reading the most recent oncology literature).
-However, this panelist said that he wouldn?t necessarily send a patient back in for a biopsy if not enough tissue was available or testing was indeterminate in 1L setting.","[026 Top 300]  HCP from a community institution was somewhat disappointed that the 026 trial was negative, but also disappointed in how many patients will realistically qualify for pembrolizumab.

HCP mentioned that the positive data from KEYNOTE-024 at the 50% PD-L1 expression level will impact his use of pembrolizumab in first-line patients.  However, HCP emphasized that way less than 25% of his patients are 50% or higher (actually more like 10-15% at his practice).

As a result, HCP mentioned that chemo still has its place in the front-line setting.  HCP is eager to see results from 227.  In second-line NSCLC, HCP is still going to use nivo as he and his staff are extremely comfortable with nivo."
contrast,auto_found,Month,1.56101602407708,0.06391248789779704,['contrast'],11,"I met with NCCN panelist for SCLC (though sees mostly NSCLC) at an NCCN center in  midwest.  She offered these insights:

She stated in her patient population she is seeing patients come in with info, asking for pembro as it did not ""fail"" trial like nivo.  Patients on nivo not asking to switch

On NCCN panel and SCLC she stated that Nivo and Nivo/Ipi given 2B rather quickly and without much discussion.  Stated this was bar was so low in second line SC.  She stated this ""sort of thing"" is considered by panel.  Stated bar would be somewhat higher in first line SCLC  (Topo/etc. has good RR but poor DOR, both important)

She, like others, felt pembro would likely get NCCN listing at 50% when data published.  She felt for nivo in first line the bar for listing would be quite high.  i.e. as pembro failed primary endpoint, if there was positive data (say at ESMO) for a cut-off above 5%, that data would have to be very good to get a listing.  This contrasts to most other panelists opinions I have heard.

On the design of 026 she felt that BMS probably had good advice given to us at ad boards when designing trial but we did not listen (she did not expand on this)

She stated that her institution just started testing for PDL-1 in house.  Prior it took 2-3 weeks for results.  Now takes 2 days",RTL in SCCHN noted at his center (Major university in midwest) they were using mostly pembro off trial for HN cancer because it has been approved longer and his center feels access is easier.  This contrasts with another major center in same city who has been using nivo all yr without any insurance issues.,"Academic RTL shared that they have seen overall 'disappointing' results with nivo in 2L/3L NSCLC patients similar to 017/057 trial populations.  States that they have seen only a handful (estimating about 5%) PR's and several shorter-term SD's (~4 months).  Has not deterred use, ""as toxicity alone is a big win"". 

In contrast, state that in about 5 SCLC patients that they have treated off-label, they have seen ""amazing"" results, with almost all getting marked benefit even though they were 4L+."
change,auto_found,Month,0.9180381094397353,0.06170854719558626,['change'],125,"NTL from NCCN institution remarked that in his opinion, within appox 4-12 months the front line setting would look like PDL-1 over 50% will be pembro OR nivo.  Under 50% will still be doublet, but that could/would change with more time","During a lung cancer symposium in the southeast region, Joseph Ritchie and I gathered the following unsolicited opinions from a NTL/ NCCN panelist (medical oncologist) at an NCI-designated cancer center in NYC
-Believes that the term ?value? is currently more of a talking point than something actionable. However, in light of -024 and -026, he sees ?value? as defining a population and not just giving expensive drugs to every patient that walks through the door.
-Also believes ORR is crucial and may even be the most important of endpoints to any conversation around value
-PD-L1 testing is as big a change as there has been in a long time when it comes to directing decision-making in oncology. If pathologists aren?t testing regularly for PD-L1, it is the duty of the medical oncologists to speak with their pathologists to better educate them (because pathologists aren?t reading the most recent oncology literature).
-However, this panelist said that he wouldn?t necessarily send a patient back in for a biopsy if not enough tissue was available or testing was indeterminate in 1L setting.","Insights gained from medical director, clinical and anatomic pathologist at community hospital in NW territory: i) PD-L1 tests are sent out to GenPath diagnostics; ii) no near-future efforts will be made to bring testing in-house; iii) 3-4 NSCLC cases are sent for testing per month; iv) Med-oncs are not reflex testing for PD-L1 as of yet but TL expects this is likely to change in the near future."
50% PD-L1 expression,auto_found,Month,1.4638221555354798,0.06134640371938198,"['testing for PD-L1', 'use pembro', '1L', '1L NSCLC', 'negative', 'PDL1 expressors', 'high expressors', '2L NSCLC', 'PDL1 status', 'KEYNOTE-024', 'not test', 'become SOC', '50% PD-L1 expression', 'routinely', 'p16']",841,"[026 - NOT Top 300; ""opted in""]  RTL from a large, progressive community institution is very ready to adopt pembro in first-line NSCLC based on KEYNOTE-024 for patients >50% PD-L1 expression.

All NSCLC patients at his institution and its satellites get tested for PD-L1 expression.  RTL will otherwise give chemo for patients <50% PD-L1 in first-line based on 026.","[026 - NOT Top 300; ""opted in""]  RTL from a large, progressive community institution (who also happens to be an investigator for KEYNOTE-021) was NOT thrilled about 026.

RTL is very ready to adopt pembro in first-line NSCLC based on KEYNOTE-024 for patients >50% PD-L1 expression.  All NSCLC patients at his institution and its satellites get tested for PD-L1 expression. RTL will otherwise give chemo for patients <50% PD-L1 in first-line based on 026.

RTL is eager to see the results for 227.  As he was also a PI for KEYNOTE-021, RTL is interested how the patients do in the nivo + chemo arm for PD-L1 <1%.","The following insights were gained from a surgical pathologist and medical director at large university hospital in NW territory: i) Last week, medical oncologists at this university hospital have made a decision to reflex test all NSCLC patients for PD-L1 expression. All tests are done in-house, the institution has only Dako platforms, and only 22C3 tests are performed. ~4 NSCLC samples are tested per week; ii) Laboratory reports PD-L1 test results as approximate percent positive tumor cells. In addition, they report tests as high (>50% PD-L1 expression), low (1-50% PD-L1 expression), and negative (0% PD-L1 expression); iii) very interested in idea of IHC multiplexing in immuno-oncology space."
reserve,auto_found,Month,0.8315659516758654,0.06083438503830683,"['preferred', '2L', 'reserve', 'platinum doublet']",382,A Lung NTL told me that he has heard the Foundation is using the Ventana SP142 antibody to fulfill requests for some of its PD-1 testing results.  The TL is aware of the Project Blueprint data and does not believe this test should be used.  The TL noted that this might hurt Merck since the SP142 test seems to read consistently lower than the Dako tests and could turn >50% staining to less than and thus out of label for Pembro.  TL went on to say this might effect BMS also since some physicians have been reserving Opdivo for patients with PD-L1 negative tests and Atezolizumab with its q3w dosing might be desirable.,"Community LTL shared that he would test for PD-L1 in 1L lung. For patients in the second line who did not qualify for 1L pembro therapy, he was planning on using pembro for patients who expressed PD-L1 and reserving nivo for non-expressers. He further shared that his reasoning for doing this is the data that he has seen for pembro in the enriched patient population.","A regional AI for lung at an academic institution in the HSL South territory shared the following unsolicited insight about nivo vs. pembro in the light of press releases for KN024 and CM026:
?	Still think that nivo and pembro are essentially equivalent. KN024 meeting its primary endpoints and CM026 not meeting its endpoint did not change anything. Believes that CM026 negative results are the consequence of risky study design choices rather than anything wrong with nivo. Reserves his final judgment until the results of KN024/CM026 are made public."
