driver,type,subset,impact,score,related_terms,doc_count,example_doc,example_doc2,example_doc3
regimen,auto_found,Month,-3.370983802578853,-0.38989227084507777,"['regimen', 'mono', 'cure', 'not tolerate', 'progression', 'discontinue', 'not respond', 'well tolerated', 'tolerate', 'cabozatanib', 'Nivo monotherapy', 'combo', 'progress', 'duration', 'patients', 'bevacizumab', 'metastatic melanoma', 'respond', 'combination', 'pts', 'treatment', 'aggressive', 'continue', 'ipi/nivo', 'everolimus', 'reduction', 'axitinib', 'decrease', 'using regimen', 'patients treated']",3851,Testing for PDL1 for melanoma is a waste of time and resources since the regimen does well with both.,National TL expressed content with the efficacy of the regimen. Has 6 patients on regimen and a few now receiving single agent and all are responding,"Thought leaders in a large community practices express concern around safety of regimen.  Patients did not tolerate single agent Yervoy, and thus hesitancy to offer regimen.  Our field sales rep have limited access to many of these practices.  Many times information is left with receptionist."
prescribing,auto_found,Month,-3.267664236633555,-0.3771632727490028,"['prescribing', 'discontinue', 'label', 'approved', 'Opdivo']",719,"Lung RTL who participated in -012 noted how important it will be to familiarize lung cancer doctors with the side effect profile for Ipi. He expressed how his melanoma colleagues had been familiar with Ipi-associated IMARs (i.e. colitis) due to prior usage, but that he wasn't used to prescribing infliximab for his NSCLC patients.","Part of a matrix presentation to a State Oncology Society.  As part of our discussion with the society staff and physician leadership, the following insights were obtained:

1. Significant dissatisfaction with BMS over the use of television marketing.  Two physicians present both indicated they felt that the use of commercials for Nivolumab was unethical.  One physician stated he felt it was ""morally irreprehensible"" and expressed extreme frustration at having to take time with patients to explain why they aren't candidates for Nivolumab that he would have been using to discuss the treatment he was going to be prescribing for them.  The Society administrators commented that this is a common theme that has been previously verbalized by multiple physician groups that are part of the state society.

2.  Physicians identified the need for more IO education for their staff members - particularly the mid--level providers.  This was an outstanding opportunity to provide information on the IOCL efforts and the various educational resources the BMS provides (wallet cards, patient checklist, IMAR guides).  The physicians were both very impressed with the information provided and indicated that they would be in contact with me to come speak to their staffs

3.  The need for talks that could have CE associated with them at their annual meeting.  They were provided information on our unbranded materials and also the Unbranded IO talk.

4.  Physicians and society staff verbalized concerns related to cost and this provided an opportunity for a discussion on this by the matrix members including data on BMS' premier access program.  The attendees expressed interest in knowing more about these programs.

5.  One physician did comment on treating a 90+ y/o patient with nivolumab with metastatic melanoma who decided to stop treatment after two doses.  The patient went on palliative care following that, but the physician is getting texts every 3 weeks from the patient's son indicating that the large lesion on his father's back continues to regress and the patient is doing very well.

6.  One physician downloaded our Opdivo APP while we were meeting with the group!",A community oncologist commented that Opdivo + Yervoy Regimen efficacy in metastatic melanoma is impressive. She will definitively prescribe the Regimen for all eligible 1st line metastatic melanoma patients. This is a very aggressive disease and there is no time to waste. You want the best clinical efficacy available in 1st line. If you wait to 2nd or later lines it may be too late.
utilized,auto_found,Month,-3.3878947951634215,-0.32529795336506107,"['utilized', 'exclusively', 'start', 'currently', 'advanced', 'bevacizumab', 'standard of care', 'everolimus', 'axitinib', 'nivolumab']",809,"Academic TL stated there is a need to educate other specialties about I-O agents, specifically the management of imAEs with these drugs (i.e. pulmonary, GI, etc). Despite the available algorithms, multiple approaches to AE management are utilized.",Community physicians hesitate to initiate immunotherapy due to safety profile.  Reluctant to utilize high dose corticosteroids due to its side effect profile in the older population and comorbid conditions.  Nursing inservice provided on managing patients receiving immunotherapy using resources/tools.  Discussion around limited options for treatments many of these patients was provided.  Long term  benefit of immunotherapy discussed.,A major academic institute utilizing Regimen as standard of care in melanoma
prove,auto_found,Month,-3.1965680859834857,-0.2376409952593349,"['prove', 'effective', 'unaware', 'better', 'confident', 'superior', 'demonstrated', 'compelling', 'derive', 'durability', 'differentiate']",447,"On 07/22, a speaker at the 11th Annual New Orleans Summer Cancer Meeting indicated that: PD-L1 is not a biomarker that allows to select individual patients for treatment; IFN-? 6-gene signature profiling might prove more suitable for this job.","RTL excited for the NEPd study, stating it will be a great option for patients. She feels the combination of checkpoint blockade with EPd will prove to be quite effective.","Community TL shared that with increasing access to nivolumab for off-label tumor types (whether via NCCN updates, patient access or insurance approval due to early data release) that enrollment to future Phase 3 nivo LCM studies may prove difficult as patients may withdraw consent when randomized to comparator chemotherapy."
treat patients,auto_found,Month,-2.272858870171757,-0.23686442035072594,"['treat patients', 'progression', 'start', 'tolerate', 'progress', 'patients', 'metastatic melanoma', 'pts', 'treatment', 'pseudoprogression', 'SD', 'continue', 'Opdivo', 'using regimen', 'patients treated', 'nivolumab']",3837,"onc practice in Houston, tx was treating patient with met melanoma with brain mets  with combo yervoy/opdivo while patient remained  for a prolonged time on high dose of corticosteroids. Subsequently,  patient has developed significant bilateral muscle weakness, lethargy, confusion which was susspected by examining neurologist as possible IO induced encephalitis. After MRI and LP it was determined that patient was suffering from steroid induced myopathy.",Melanoma NTL feels that the most crucial data needed is what to treat patients with after progression on regimen.,"Regional lung TL told me that he hasn?t treated any patient with autoimmune disease with IO intentionally, he has however seen a patient develop RA following nivo treatment. Patient has been managed with steroids and will be restarting nivo."
FDA approved,auto_found,Month,-2.692115882455702,-0.23419951305228015,"['FDA approved', 'approved', 'FDA']",201,A regional TL commented how every other patient coming to his office asks about Opdivo.  While he is not a fan of DTC he appreciates how the conversation has changed for him.  In the past the conversation was about why natural products not proven safe or effective in cancer treatment.  At least now he feels he is discussing a product that is FDA approved and it has been proven safe and effective in randomized clinical trials.,"A national RCC TL said that Nivolumab is ""absolutely going to maintain itself as SOC in second line RCC"".  He offered that he could not fathom why the FDA approved Lenvatinib off of only PFS data and it being a Phase II study.",Academic TL presented information on Pembro in R/R HL pts with 50% PFS at 3-4 years.   He stated that OS looks good with PD-1 inhibitors but is relatively small numbers.   He stated that it is FDA approved (showing Pembro slide) and that it is a good option.
clinically,auto_found,Month,-2.5343027096923767,-0.22892587926490213,"['cure', 'clinically', 'progression', 'not respond', 'achieved', 'duration', 'respond', 'responders', 'demonstrated', 'treatment', 'pseudoprogression', 'SD', 'durability', 'durable']",993,Local HCP shared off-label treatment of patient with metastatic prostate cancer with Opdivo demonstrated quick response in PSA and clinically.  The patient is tolerating the single agent without adverse events to date.,"A TL, clinical trials PI, and AI commented that she no longer uses scans to make definitive treatment decisions for patients receiving I-O therapies. She believes that a thorough clinical evaluation of the patient is more important than looking at scans. If the patient is clinically doing well it may be pseudoprogression and she usually does not stop therapy at that point. She has seen patients deriving benefit from treatment after an apparent initial progression. Therefore she believes that, with I-O agents, benefit derived by the patient is currently the single most important factor when making treatment decisions. Scans provide supplemental information. This needs a change in oncologists mindset that are used to immediately react to scans. There is also a need for more research in order to identify better objective measures that can be used to monitor response to I-O agents.","Community Pharmacist stated they had a few patients they thought had progressed on Opdivo when it was really pseudoprogression because they were clinically stable as you have described in this ""unbranded"" deck."
possibly,auto_found,Month,-2.1367911004860267,-0.20665835724299406,"['possibly', 'tolerate', 'metastatic melanoma', 'patients treated']",175,Community HCP reporting that he is seeing all his OPDIVO patients every treatment and is still having to discontinue treatment due to pneumonitis.  Teaching provided to nurses and support staff around identifying symptoms early.  Patients needing to be educated on contacting office with early onset of changes from baseline so patients do not need to be discontinued..  Perception here is that physicians feels he is closely following patient and still patients having IMARs requiring d/c of treatment and lesser response rate with this office.  Physician hesitating use of OPDIVO and possibly use PEMBRO in his high PDl-1 expressors which means he now wants to test where is was not testing.,"NTL said that, in wake of -026, we should present the 50+% PD-L1 expression cohort from -057 at the next available congress. This would help allay concerns from -026, and possibly add some clarification.",A melanoma RTL stated that they will use nivolumab in patients with RA and possibly even some patients who have undergone solid organ transplant but would never consider using nivolumab in a patient with autoimmune colitis.
initially,auto_found,Month,-2.419629096444684,-0.20134459960682602,"['initially', 'previously', 'rapidly', 'unable']",94,"Following up on a previous insight from MB regarding the EA6134 trial, an melanoma NTL from MD relayed a conversation he had recently with Novartis.  The reason by the trial hold / insufficient drug supply resulted from unexpected greater commercial demand for the drugs.  GSK initially transferred the remaining inventory of the BRaf/Mek inhibitors to Novartis which allocated a small fraction for R&D purposes.  Novartis has been unable to get their own production going.  They asked GSK to make some additional drug but this will take time.  All Novartis would commit to was that drugs would be available for the trial sometime after April 1st.  The TL added that he did not expect the drugs to show up in April and had no clear idea when they would be available.","An HCP believes that it is important for us to determine the optimal duration of treatment for patients that achieve a good response to Opdivo. She has noticed that in her responding patients, continued treatment for months or years, has led to the development of idiosyncratic AEs in patients who tolerated Opdivo well initially.","A regional melanoma TL shared with me that he initially started a melanoma patient on Pembro, but the patient showed no response.  He then switched the patient to the Ipi/Nivo regimen and has since started responding.  He was hesitant to use the combination upfront because of the potential of toxicity, but now he thinks that the regimen should be used upfront in otherwise healthy patients, and as salvage therapy for monotx progressers."
assume,auto_found,Month,-2.1490163613011486,-0.19706860052007155,['assume'],22,"A community TL shared that Merck (mentioned rep, but I am assuming he meant MSL) is proactively speaking to the -067 PDL1 data contained in our label to point out that in PDL1+ melanoma patients, use of single agent anti-PD1 gets the same results as combined nivolumab+ipilimumab.","Community TL stated that he felt more comfortable using nivolumab in 1L for non-EGFR or ALK patients (than EGFR mut or ALK mut patients) based on efficacy shown in 2L he assumes nivo would be ""just as good"" or better in 1L patients","RTL who did not attend AACR shared that he had reached out to his Merck MSL for a copy of the KN-006 presentation assuming that there would have been an OS update and was extremely disappointed that the presentation was in fact ""just space filler data to get them on the agenda and I'm now assuming that the OS isn't going to look great once we actually see it"".  TL shared that ""no matter how they keep trying to cut this PDL1 data, nobody wants to test and it just makes them look desperate""."
limited,auto_found,Month,-2.0496340149677534,-0.1952219958997652,"['limited', 'eligible', 'standard of care', 'approved']",226,"Thought leaders in a large community practices express concern around safety of regimen.  Patients did not tolerate single agent Yervoy, and thus hesitancy to offer regimen.  Our field sales rep have limited access to many of these practices.  Many times information is left with receptionist.",Community physicians hesitate to initiate immunotherapy due to safety profile.  Reluctant to utilize high dose corticosteroids due to its side effect profile in the older population and comorbid conditions.  Nursing inservice provided on managing patients receiving immunotherapy using resources/tools.  Discussion around limited options for treatments many of these patients was provided.  Long term  benefit of immunotherapy discussed.,"Neuro-ONC stated that in ""slow growth"" recurrent GBM patients that he will try combinations of Opdivo, Opdivo+Bev, Opdivo+Yervoy.  Has had limited success with each possible, but stated that ""limited success is still success in GMB."""
single agent,auto_found,Month,-3.252973992751614,-0.15973668118997514,"['not tolerate', 'single agent', 'bevacizumab', 'everolimus']",117,National TL expressed content with the efficacy of the regimen. Has 6 patients on regimen and a few now receiving single agent and all are responding,"Thought leaders in a large community practices express concern around safety of regimen.  Patients did not tolerate single agent Yervoy, and thus hesitancy to offer regimen.  Our field sales rep have limited access to many of these practices.  Many times information is left with receptionist.",Community TL shared that he has recently presented a melanoma patients to two separate physicians at MD Anderson (site is affiliated with MDACC)  and they both gave a different response on how to treat. One suggested only anti-PD1 monotherapy and the other suggested regimen. He was very frustrated and suggested we work hard to develop a useful biomarker(s) for helping community physicians know when to use regimen vs single agent.
likely,auto_found,Month,-1.4463143808748808,-0.14451558873675321,"['likely', 'regardless']",177,"Biomedical Learning Institute 1st Annual Symposium on Integrating Immune Therapies & Target Therapies into Standards of Care for Heme and Solid Malignancies; San Fran Sept 10, 2016 
Well Attended with over 200 attendees/ Merck was a sponsor as well as other companies (foundation medicine).   BMS was not one of the major sponsors.  

Lung: One of the major questions was: Are antiPD-1 agents interchangeable, and the presenters overall argued for yes they are the same (nivo/pembro). The schedule differences were mentioned several times highlighting Pembro
Insights 
?	Oak Trial results were mentioned for Atezo (Atezo was alleged as More toxic of the agents)
?	Pembro and Nivo have same toxicity profile
?	We don?t need a cross trial comparison since the populations were very similar and Nivo performs regardless of pd staining percentages
?	Commented that there are so many duplicative 2nd line trials amongst PD-1 inhibitors.  There is pressure to move into front line setting.  
?	In reference to 1st line lung press releases ? ?Merck cherry picked their patients? for trial, and consensus was that no doc on panel board would use off label 1st line IO tx unless on trial, they are all waiting for data; they all concluded that BMS strategy in 1st line did not pay off, and chemo ?isn?t going anywhere?, since only 50% of pts likely have pd expression. One TL did comment that if he did he would use Pembro as the data is there and it has the best schedule. 
?	Awaiting Blueprint project for further information on which testing to use (docs agreed that most facilities will pick one test and use exclusively due to cost and training)
?	All panel board docs advised audience to get PD status on new dx pts.  The question was asked if testing should be mandatory for newly diagnosed patients and they all said yes.  
?	National TL discussed Nivo trial looking at OS by PDL1 expression and stated 10% had better OS and that PDL-1 staining does predict OS. 
?	A lot of excitement over Ipi/Nivo combo in Lung  
1.	Mentioned that it is very alluring to give a boost of Ipi when single agent IO is fizzling to boost responses (no data to support however)
?	*Pseudoprogression mentioned many times ?does not exist in lung? ?pts refuse to be taken off of tx even in the face of wild progression?
?	Mentioned BMS 153 trial looking at early stopping of tx  Discussed the need to look at how long to continue these therapies.  TL went on to say he wasn?t sure how the data would pan out with this trial since many patients don?t survive to 1 year which is the cutoff for the trial to continue without therapy.
Costs: Cost was mentioned many times with one quote from podium for Lung 1st Line ?The only thing more expensive than IO is IO combo? 


Melanoma: Dr. J. Weber was one of the 2 presenters- NTL 
*Discussed BRAF pts to use targeted or IO first line setting (no consensus, both sides argued)
*Weber alleged Ipi/Nivo regimen is ?very toxic? and ?very effective? tx. Targeted Tx?s are less toxic that Combo IO. 
*advised audience to use 8 weeks of Targeted tx and move on to regimen of ipi/nivo
*Tvec treatment cant compare to IO
*064 Trial highlighted as switch approach 
*Encouraged extrapolating data from Lung Trial 012 for melanoma and to use reversed dosing or Ipi Q6w or Q12w
*believes adding braf inh target tx to IO combo will be very effective

Other solid Tumor:
-Pancreas: stated due to hypoxic pancreas tumor micro-environment and no local tcells that single agent antiPD1 hasn?t worked so far
Prostate: Discussed ipi negative trial and that bone disease only arm did much better 
H&N: Stated Nivo is new standard of care",NTL for Pediatric lymphoma at a large academic center stated that Nivolumab is very good for PRs with not as many CRs so it would likely not be used as a single agent earlier in the disease.,NP and speaker previously reported that they treated a couple of young BRAF + patients with rapidly progressing disease drabrafenib/mekinist + opdivo 3/ ipi 1. Both of the patients needed to discontinue due to toxicity. Patients are on the BRAF/MEK inhibitors until they progress and will likely introduce the regimen after that
anti-PD-L1,auto_found,Month,-2.300811288924264,-0.1350796568990535,"['combo', 'anti-PD-L1', 'bevacizumab', 'standard of care', 'combination', 'everolimus', 'enrollment']",449,"RTL from a large community institution mentioned that he was ""surprised that the safety of PD-L1 inhibitors (i.e., avelumab) wasn't as good as PD-1 inhibitors"" in terms of reducing immune-mediated AEs (as originally thought).  RTL was actually one of the authors for the JAVELIN solid tumor trial for avelumab (anti-PD-L1) presented at ASCO.  Interestingly in that poster, RTL mentioned that there was also a 16% infusion-related reaction rate from the 1,300 patients enrolled (pan-tumor), which mandated a premed regimen of APAP and Benadryl into the protocol.","Lung RTL volunteered the following information about the MYSTIC 1st line trial in patients with NSCLC of Durvalumab (anti-PD-L1) +/- Tremelimumab (anti-CTLA-4) versus Standard of Care (chemotherapy)

-          TL?s site at top of enrollment (target close to 800 patients).  Fairly easy to convince patients to participate.
-          Randomization was 1:1:1
-          Site enrolled 16 patients; 4 screen failed ; 12 treated
-          Thinks 4-5 patients received combination of Durvalumab and Tremelimumab.  Thinks 2-3 had Objective Responses
-          Combination very well tolerated.
-          Infusion of both drugs on same day (in combination arm) at 4 week intervals.  Tremelimumab limited to 4 doses maximum.  Durvalumab treatment until progression of unacceptable toxicity.","Several RTL in NY have all noted at least one patient case where a patient is currently responding to the Regimen and the ORR appears to be better than prior responses to a prior PD-1 / PD-L1 therapy.  Appears to be trend to response to Regimen if some prior but minimal /transient response.  Examples:
-	Patient with uveal melanoma.  Minor /short duration response to Pembro.  Progressed quickly on targeted therapy clinical trial, responding well for 3+ months to Regimen
-	Patient with melanoma.  Progressed on anti-PD-L1 trial, stable disease for a few months with Pembro, progressed on BRAF/Mek, good response to Regimen
-	Service has tried Regimen after progression on Pembro as first line therapy in about 5 patients.  TL believes they have seen objective responses in 2 patients."
candidates,auto_found,Month,-1.6607362028032886,-0.13030996277521703,"['not tolerate', 'eligible', 'candidates', 'patients', 'relapsed', 'treatment options']",1787,"Melanoma RTL stated you need to approach treating a pt with regimen with flexibility.  First, make sure the patient is a good candidate (PS, comorbidities, can they tolerate).  Secondly, some pts may tolerate all 4 doses with no issue while others may have significant toxicity after 1 dose requiring discontinuation, but patient may respond to just 1 dose.  Physicians need to assure the patients may continue to respond after treatment or even when they discontinue the medicine.  TL referred to ASCO data where pts where off treatment and continued to respond durability.  She stated we need to under the biological underpinnings of these types observations.  What baseline immune characteristics allow one pt to only tolerate 1 dose and another patient can tolerate all 4 doses with no issue.  TL also stated BMS needs more studies looking at when to discontinue Regimen or single agent Nivo for pts who have achieved deep response and maintained it for a period of time.",RTL at academic center reports would like to utilize nivo in patients who are not BV candidates either due to peripheral neuropathy from ABVD or DM or who have received BV and unable to continue due to peripheral neuropathy,NTL at a large academic center stated that there needs to be an interest on BMS part for CAR-T in NHL.  He is nterested in research with CART cell therapy in second line lymphoma.  He would give CHOP then transplant then candidate for CART.  Noticed significant Lymphocyte depletion and hard to collect T cells. Give Nivo then response without depleting T cells and can achieve CRs with enhancement of lymphocytes prior to CART.
recommended,auto_found,Month,-1.8322359425707893,-0.12907317355354977,"['recommended', 'advised']",45,Regional TL reports that Merck reps are recommending that doctors use the Opdivo app for a management algorithm for pembro,"HCP has questions around management of IMARs and fevers.  Reviewed IMAR guide, algorithm.  Also discussion around fevers and recommended febrile work-up.  Possible cytokine release and treat as IMAR if no source of febrile episode. Also questions around efficacy with steroids and IMARs.",TL shared that when treating melanoma patient with regimen he routinely monitors CPK and troponin during combo phase due to risk for cardio tox (observed in several patients on study). Recommends that BMS educate physicians on monitoring for this when using regimen.
